"","x"
"1",caus know devil may cri dumpster fire
"2",devil may cri hd collect steam gmg w code risingsun
"3",devil may cri hd collect steam gmg w code risingsun
"4",devil may cri hd collect steam gmg w code risingsun
"5",devil may cri hd collect steam gmg w code risingsun
"6",warfram final fantasi tactic armor core monster hunter phantasi star onlin honor mention vanquish devil
"7",will guy collector edit dmc partner loot crate make mak
"8",devil may cri hd collect steam gmg w code risingsun
"9",xenoblad chronicl x under night inbirth guilti gear xrd revel devil may cri persona
"10",devil may cri hd collect steam gmg w code risingsun
"11",devil may cri hd collect steam gmg w code risingsun
"12",wild arm devil may cri silent hill final fantasi xiv rock band
"13",batman arkham cityknight devil may cri black max payn gear war
"14",i like video thing realli need know devil may cri
"15",devil may cri hd collect steam gmg w code risingsun
"16",bloodborn mother devil may cri doom spiderman pizza deliveri mission
"17",devil may cri hd collect steam gmg w code risingsun
"18",devil may cri like bitch
"19",devil may cri hd collect steam gmg w code risingsun
"20",devil may cri hd collect steam gmg w code risingsun
"21",devil may cri hd collect steam gmg w code risingsun
"22",devil may cri hd collect steam gmg w code risingsun
"23",devil may cri hd collect steam gmg w code risingsun
"24",devil may cri hd collect steam gmg w code risingsun
"25",devil may cri hd collect steam gmg w code risingsun
"26",devil may cri hd collect steam gmg w code risingsun
"27",devil may cri hd collect steam gmg w code risingsun
"28",devil may cri hd collect steam gmg w code risingsun
"29",devil may cri hd collect steam gmg w code risingsun
"30",devil may cri hd collect steam gmg w code risingsun
"31",devil may cri hd collect steam gmg w code risingsun
"32",devil may cri hd collect steam gmg w code risingsun
"33",what fantast takeaway studio take time away return seri clear creativelyrecharg mind
"34",planescap torment super smash bros castlevania symphoni night devil may cri dungeon dragon shadow
"35",i like video minut devil may cri gameplay xbox one x gamescom
"36",case point im big spectacl fighter like devil may cri bayonetta yet i like th
"37",what fantast takeaway studio take time away return seri clear creativelyrecharg mind
"38",devil may cri valkyri profil persona fallout deus ex
"39",what fantast takeaway studio take time away return seri clear creativelyrecharg mind
"40",i chat cute cashier today told i devil may cri voic what mean was
"41",legaci kain soul reaver final fantasi persona unchart devil may cri
"42",devil may cri persona innoc sin tekken yakuza kiwami graviti rush
"43",what fantast takeaway studio take time away return seri clear creativelyrecharg mind
"44",what fantast takeaway studio take time away return seri clear creativelyrecharg mind
"45",persona silent hill dark soul pokemon hgss blackwhit devil may cri
"46",was just brows file rememb laughabl bitter ninja theori old devil may cri fan put
"47",when someon know devil may cri
"48",devil may cri gameplay show nero fight goliath
"49",devil may cri silent hill fallout new vega red dead redempt kingdom heart
"50",devil may cri special edit part capcom dmc
"51",was just brows file rememb laughabl bitter ninja theori old devil may cri fan put
"52",kingdom heart final fantasi x devil may cri shovel knight sli cooper
"53",devil may cri gameplay show nero fight goliath
"54",was just brows file rememb laughabl bitter ninja theori old devil may cri fan put
"55",devil may cri gameplay show nero fight goliath
"56",bayonetta devil may cri resid evil stuff three hammi t
"57",im sure capcom take shot fashion unless ninja theori snuck
"58",what fantast takeaway studio take time away return seri clear creativelyrecharg mind
"59",what fantast takeaway studio take time away return seri clear creativelyrecharg mind
"60",hello capcom i fan devil may cri i want add game arab increas num
"61",hello capcom i fan devil may cri i want add game arab increas nu
"62",what fantast takeaway studio take time away return seri clear creativelyrecharg mind
"63",off top head s list ps great exclud god war kingdom heart shadow colossus devi
"64",what fantast takeaway studio take time away return seri clear creativelyrecharg mind
"65",interest tweet yet continu ignor offer three mario wed amiibo debat m
"66",what fantast takeaway studio take time away return seri clear creativelyrecharg
"67",nier automata drakengard final fantasi xv final fantasi type devil may cri
"68",i hope hard dmc littl bit harder not easi like dmc devil may cri love greet argentina
"69",devil may cri nova seri
"70",was just brows file rememb laughabl bitter ninja theori old devil may cri fan put
"71",was just brows file rememb laughabl bitter ninja theori old devil may cri fan put
"72",was just brows file rememb laughabl bitter ninja theori old devil may cri fan put
"73",ps legend dragoon n majora mask dreamcast sonic adventur ps devil may cri gamecub pokemon channel x
"74",yakuza realli no more hero shovel knight devil may cri god hand
"75",ps legend dragoon n majora mask dreamcast sonic adventur ps devil may cri gamecub pokemon chann
"76",buy devil may cri hd collect you good tast
"77",i ad video playlist devil may cri vergil hard i ptbr
"78",memer metal gear devil may cri we can never truli fight sinc most pc lmao i alway g
"79",minut devil may cri s stylish gameplay k
"80",persona final fantasi x code realiz devil may cri
"81",devil may cri gameplay show nero fight goliath
"82",i like video dmc all of nero new devil breaker arm in devil may cri
"83",real list haha ocarina time final fantasi metal gear solid devil may cri bloodborn
"84",check broadcast playstat devil may cri hd collect live
"85",devil may cri wildin right bat my man said gonna rip chest open bare hand eat hi
"86",god hand persona devil may cri torchlight the entir yakuza franchis
"87",no smt nocturn featur dant devil may cri seri lmao jk dds amaz list
"88",devil may cri shin megami tensei nocturn no more hero tactic ogr let us cling togeth bloodborn
"89",god hand persona devil may cri torchlight the entir yakuza franchis
"90",new video enthusiac bug man bug out devil may cri
"91",i like video pax west game discuss super mario parti kh devil may cri mm indi
"92",ff mkx devil may cri sonic halo
"93",okag yakuza devil may cri kenka banchou toni hawk proskat ace attorney
"94",was just brows file rememb laughabl bitter ninja theori old devil may cri fan put
"95",oooh boy devil may cri final fantasi x dead aliv mirror edg jak it second natur play game
"96",devil may cri gameplay show nero stylish combat
"97",planescap torment super smash bros castlevania symphoni night devil may cri dungeon dragon shadow
"98",new video enthusiac bug man bug out devil may cri
"99",devil may cri gameplay show nero fight goliath
"100",off top head s list ps great exclud god war kingdom heart shadow colossus devi
"101",oh god carl cj johnson devil may cri seri
"102",ps one disast churn drivel made d gfx way tech even
"103",fifa gta v god war devil may cri lumin
"104",devil may cri the witcher wild hunt dungeon dragon dragon age bloodborn
"105",was just brows file rememb laughabl bitter ninja theori old devil may cri fan put
"106",persona blazblu central fiction devil may cri celest xenoblad chronicl x
"107",was just brows file rememb laughabl bitter ninja theori old devil may cri fan put
"108",devil may cri trish cosplay test
"109",ninja gaiden black devil may cri resid evil halo marvel vs capcom
"110",devil may cri marathon babi
"111",gtocarina time gtace attorney gtfinal fantasi xiii gtsuper metroid gtdevil may cri
"112",as point shane resid evil devil may cri part game hiatus behav
"113",devil may cri gameplay show nero fight goliath
"114",the wolf among us monster prom devil may cri undertal borderland
"115",devil may cri
"116",devil may cri gameplay show nero stylish combat
"117",devil may cri hd collect ps download read detail frugal game
"118",resid evil nemesi bayonetta street fighter iii rd strike hitman devil may cri
"119",dmc devil may cri i know peopl give game lot crap i absolut love it b
"120",honest id say give attent ip everyon thought go dead devil may c
"121",kirbi fuck die featur dant the devil may cri seri
"122",devil may cri megaman x yugioh duelist rose naruto ultim ninja leagu legend
"123",wow leagu legend devil may cri dissidia ff tekken
"124",at pax i chanc play fifa tunic darksid devil may cri die light br spiderman while
"125",devil may cri gameplay show nero fight goliath
"126",devil may cri nero
"127",me featur ear devil may cri seri
"128",dragonbal fighterz metal gear solid persona devil may cri resid evil
"129",devil may cri has dant
"130",the legend zelda world warcraft ninja gaiden devil may cri halo
"131",ico shadow colossus metal gear solid devil may cri yes i know yet ride t
"132",i think devil may cri game definit year take place
"133",devil may cri legend zelda the last us life strang spider man ps
"134",devil may cri gameplay show nero fight goliath
"135",world warcraft devil may cri seri fallout simpson hit run final fantasi
"136",world warcraft devil may cri seri fallout simpson hit run final fantasi
"137",damn notic follow thank much look forward devil may cri
"138",breath wild mario vs rabbid kingdom battl nier automata twilight princess devil may cri
"139",time play devil may cri og
"140",off top head s list ps great exclud god war kingdom heart shadow colossus devi
"141",i like video devil may cri hd collect gameplay walkthrough part pc p hd fps no
"142",realli tho might tri tomorrow im done today goodnight everyon dont ever play second devil may
"143",can now tell s devil may cri fan now alway want play never game though
"144",silent hill resid evil disgaea bloodrayn devil may cri
"145",me featur ear devil may cri seri
"146",dant devil may cri
"147",i love daunt devil may cri
"148",warcraft the frozen throne starcraft alpha centauri super mario devil may cri
"149",i like video pax west game discuss super mario parti kh devil may cri mm indi
"150",dant devil may cri
"151",dant devil may cri
"152",devil may cri gameplay show nero fight goliath
"153",shenmu crysi dead aliv last round sonic adventur devil may cri
"154",was just brows file rememb laughabl bitter ninja theori old devil may cri fan put
"155",was just brows file rememb laughabl bitter ninja theori old devil may cri fan put
"156",what remain edith finch devil may cri hotlin miami dark soul doom
"157",monster hunter seri devil may cri seri dragon quest guilti gear seri pokemon seri
"158",ich mag das video devil may cri k gamescom
"159",mass effect metal gear solid shadow colossus devil may cri twist metal black
"160",devil may cri style ghost rider game sick
"161",ever tell dream million dollar game idea work imagin kill la kill game t
"162",brave default devil may cri xenogear final fantasi ix drawn life
"163",devil may cri trish cosplay test
"164",photo modegalleri provid insid shot devil may cri van
"165",persona monster hunter realli pokemon sunmoon shant halfgeni hero devil may cri
"166",hello fgc player want good way practic mash time go play devil may cri seri if m
"167",okay time finish devil may cri max difficulti
"168",was just brows file rememb laughabl bitter ninja theori old devil may cri fan put
"169",the mr devil may cri fucboi mutual love dant love dant love dant dont much common tha
"170",devil may cri gameplay show nero fight goliath
"171",devil may cri part jackpot
"172",have high rank alway hard devil may cri tri gamescom fluid gameplay grap
"173",i love devil may cri saga movi anim devil may cri ps m
"174",tesv skyrim battlefield e o shadow the colossus devil may cri o e reboot tbm world warcraft
"175",strang look like dant devil may cri
"176",devil may cri shape well new return player
"177",ever tell dream million dollar game idea work imagin kill la kill game t
"178",i ad video playlist devil may cri devil trigger epic metal cover littl v
"179",ever tell dream million dollar game idea work imagin kill la ki
"180",devil may cri minut de gameplay devilmaycri
"181",evolut devil may cri game
"182",featur dant devil may cri seri
"183",devil may cri has dant
"184",uff devil may cri a link past final fantasi a fire emblem isnt fate civil
"185",evolut devil may cri game
"186",castlevania symphoni night marvel vs capcom devil may cri counterstrik global offens tetri
"187",god war seri devil may cri seri assassin creed seri dragon age seri destinydestini
"188",dragon quest monster hunter ultim devil may cri kirbi amaz mirror paper mario
"189",the world end with you muramasa rebirth anarchi reign trail sky devil may cri
"190",final fantasi unchart fire emblem devil may cri stardew valley
"191",devil may cri devil breaker trailer
"192",devil may cri dmc dragon ball fighterz middleearth shadow mordor ani game
"193",ocarina time metal gear solid final fantasi x silent hill the witcher devil may cri jak
"194",i like video devil may cri theme song never surrend
"195",devil may cri announc trailer
"196",devil may cri nier automata persona skullgirl
"197",devil may cri shape well new return player game news co
"198",devil may cri gameplay show nero stylish combat
"199",the world end with you shin megami tensei iv xenoblad chronicl devil may cri metroid fusion
"200",hollow knight devil may cri kingdom heart bloodborn persona prolli
"201",i ad video playlist devil may cri ost casey edward feat ali edward devil trigger
"202",devil may cri track
"203",at long last i can express love devil may cri v meme frustrat get bigger
"204",the orang justic emot featur vergil devil may cri suggest
"205",the orang justic emot featur vergil devil may cri suggest
"206",the orang justic emot featur vergil devil may cri suggest
"207",devil may cri origin releas
"208",had great time play devil may cri everyon relearn game blast hope
"209",bro im gonna kms i play devil may cri
"210",fire emblem devil may cri megaman battl network twilight princess tale abyss unord i think
"211",devil may cri vergil hard i ptbr
"212",devil may cri gameplay show nero stylish combat
"213",devil may cri gameplay show nero fight goliath
"214",kirbi devil may cri pokemon gold nier automata monster hunter
"215",sonic the legend zelda ocarina time super street fighter turbo kingdom heart devil may cri
"216",devil may cri legaci kain soul reaver elder scroll v skyrim blood ii the chosen oxenfre
"217",play devil may cri can watch dumb vape video
"218",digit devil saga devil may cri deus ex bind isaac thief
"219",play devil may cri can watch dumb vape video
"220",verbal dmc devil may cri
"221",nsfw zoro vs sanji differ oda page space bring zoro sanji hunki jock ott
"222",joshua promis land ultra plus now star dant devil may cri seri knuckl
"223",new dmc screen first full look dant devil may cri look stylish sss
"224",new video devil may cri whi vergil take nero devil bringer arm is corrupt brainwash that much mor
"225",off top head s list ps great exclud god war kingdom heart shadow colossus devi
"226",your follow buy devil may cri hd collect
"227",shadow of the colossus kingdom heart devil may cri bloodborn super metroid
"228",devil may cri
"229",featur dant devil may cri seri
"230",the last us god war bayonetta super mario world devil may cri
"231",dragon age inquisit dragon age origin dragon age final fantasi x devil may cri
"232",devil may cri gameplay show nero fight goliath
"233",off top head s list ps great exclud god war kingdom heart shadow colossus devi
"234",your follow buy devil may cri hd collect
"235",mine resid evil silent hill devil may cri halo dead space
"236",legend zelda link past pokémon soulsilv origin silver street fighter ii i realli
"237",daley smoke sick style pictur devil may cri refer
"238",devil may cri nero moveset hd p
"239",off top head s list ps great exclud god war kingdom heart shadow colossus devi
"240",devil may cri resid evil team fortress serious sam metal gear solid
"241",bloodborn night wood devil may cri cave stori the bind isaac
"242",the devil may cri
"243",your follow buy devil may cri hd collect
"244",metal gear solid v the phantom pain the elder scroll v skyrim special edit persona devil may
"245",off top head s list ps great exclud god war kingdom heart shadow colossus devi
"246",devil may cri bloodborn the last us hato boyfriend kingdom heart
"247",devil may cri will photo mode train mode
"248",off top head s list ps great exclud god war kingdom heart shadow colo
"249",joshua promis land ultra plus now star dant devil may cri seri knuckl
"250",devil may cri doom bloodborn vanquish pokemon sunmoonora
"251",metroid prime super mario brother kingdom heart devil may cri final fantasi
"252",was just brows file rememb laughabl bitter ninja theori old devil may cri fan put
"253",was just brows file rememb laughabl bitter ninja theori old devil may cri fan put
"254",psthe legaci kain soul reaver nsuper smash bro dreamcastjet set radio psdevil may cri gamecubeson adventur
"255",was just brows file rememb laughabl bitter ninja theori old devil may cri fan put
"256",face crowd will smile devil may cri end night
"257",earn psn trophi bronz dmc devil may cri definit edit
"258",guilti gear xx core plus r soulcalibur ii tale symphonia final fantasi x xii devil may cri se
"259",face crowd will smile devil may cri end night
"260",banjo kazooi left dead warcraft chrono trigger devil may cri
"261",devil may cri gameplay show nero fight goliath
"262",dark soul devil may cri legend zeldamm botw super smash bros dragonbal fighterzund nightst
"263",last least i want thank kick
"264",ladi devil may cri
"265",devil may cri
"266",crash team race day reckon devil may cri def jam fight for ny nba street vol
"267",dark soul devil may cri legend zelda botw dragon ball fighterz under in birthst super smash bros
"268",oddworld stranger wrath hato boyfriend godhand life strang dmc devil may cri i post earlier
"269",devil may cri kid icarus upris twilight princess unchart tale abyss
"270",game dynasti warrior devil may cri v yakuza armor core v mega man nes mega man v gamebo
"271",the orang justic emot featur vergil devil may cri suggest
"272",i like video devil may cri dant new weapon nero gameplay breakdown
"273",the world end with you final fantasi devil may cri special edit the legend zelda skyward sword donkey ko
"274",devil may cri gameplay show nero fight goliath
"275",kirbi adventur muramasa the demon blade devil may cri sonic mania megaman battl network
"276",was just brows file rememb laughabl bitter ninja theori old devil may cri fan put
"277",devil may cri shape well new return player
"278",psthe legaci kain soul reaver nsuper smash bro dreamcastjet set radio psdevil may cri gamecubeson a
"279",devil may cri ost devil trigger
"280",let play devil may cri blind part pier pursuit
"281",featur dant devil may cri seri
"282",at long last i can express love devil may cri v meme frustrat get bigger
"283",game dynasti warrior devil may cri v yakuza armor core v mega man nes mega man v gameboy
"284",devil may cri shape well new return player
"285",devil may cri gamescom trailer
"286",jing king bandet seven dead sin devilman cri babi romeo x juliet gun x sword trigun cowboy beb
"287",you shall rememb consol brought jak daxter ratchet clank sli cooper kill zone onimusha
"288",devil may cri gameplay show nero fight goliath
"289",cyberpunk spiderman ps devil may cri metro exodus nioh
"290",devil cri shall never surrend devil may cri origin demo
"291",red dead redempt deus ex yakuza nier automata devil may cri
"292",cyberpunk spiderman ps devil may cri metro exodus nioh
"293",devil may cri will photo mode train mode
"294",devil may cri shape well new return player
"295",liter minut devil may cri i alreadi lost plot
"296",devil may cri shape well new return player
"297",devil may cri shape well new return player destructoid
"298",for moon war mine but anoth metal gear devil may cri mayb ruiner hardcor
"299",bolen continu first playthrough devil may cri come join
"300",devil may cri plot dmcv
"301",devil may cri gameplay show nero stylish combat
"302",castlevania symphoni night devil may cri the last us the king fighter megaman x
"303",killer devil may cri front mission one snes shin megami tensei nocturn saya no uta
"304",devil may cri trish cosplay test
"305",my entir person sum play portal borderland skate battleblock theater devil may
"306",face crowd will smile devil may cri end night
"307",devil may cri gameplay show nero fight goliath
"308",i like video devil may cri k gamescom
"309",devil may cri gameplay show nero fight goliath
"310",super smash bros starcraft brood war devil may cri iii sm kingdom heart
"311",system shock devil may cri special edit no more hero castlevania symphoni night fategrand order
"312",devil may cri plot dmcv
"313",banjokazooi darksid brutal legend deus ex mankind divid devil may cri
"314",devil may cri real
"315",i miss old devil may cri game turn dant mgk
"316",dragon age dragon age inquisit witcher bloodborn devil may cri
"317",jet set radio bayonetta devil may cri marvel vs capcom persona
"318",persona blazblu cross tag battl danganronpa v devil may cri tekken
"319",kingdom heart devil may cri dillon roll western fire emblem awaken splatoon
"320",featur dant devil may cri seri
"321",final fantasi xiv sakura war so long my love soul calib iii devil may cri dant awaken st
"322",super smash bros sonic hedgehog devil may cri bayonetta resid evil
"323",sli cooper spyro dragon metal gear solid devil may cri phoenix wright
"324",que tal un god war o devil may cri
"325",devil may cri develop capcom
"326",devil may cri trish cosplay test
"327",devil may cri combin ear cool with superbl slick swordplay
"328",no hero devil may cri ani mainlin blazblu game odin sphere bioshock
"329",bolen continu first playthrough devil may cri come join
"330",devil may cri s graphic sooo much exposit
"331",lmaoooo disrespect devil may cri silent hill though
"332",devil may cri discuss nero buster arm thank watch bless day
"333",actual decid stream last resort tri sell shirt here link stream de
"334",repres dant devil may cri link get obliter virgil
"335",check broadcast playstat devil may cri special edit live
"336",pokemon blackwhit kingdom heart devil may cri street fighter third strike shin megami tensei
"337",loki adventur baker brief ingress tell ventur loki ice cake made croissant
"338",dead space halo devil may cri hollow knight dark soul
"339",bioshock infinit batman arkham knight devil may cri assassin creed del al last us
"340",cod mw unchart seri devil may cri final fantasi fortnit
"341",marvel vs capcom infinit sonic generat dmc devil may cri incred hulk ultim destruct metal gear risin
"342",devil may cri special edit platinum trophi platinum unlock trophi
"343",devil may cri one the best soundtrack game histori
"344",bolen continu first playthrough devil may cri come join
"345",star ocean till the end time xenogear red faction devil may cri the evil within
"346",devil may cri will photo mode train mode
"347",i just want preorder devil may cri
"348",crash jak ratchet clank devil may cri special edit rayman
"349",was just brows file rememb laughabl bitter ninja theori old devil may cri fan put
"350",persona yakuza devil may cri resid evil kingdom heart
"351",princ persia the sand time hollow knight dmc devil may cri braid shadow colossus
"352",metal gear solid twin snake legend zelda ocarina time kingdom heart devil may cri tale vesperia
"353",pax west capcom show off devil may cri v weapon featur bloodi disgust
"354",devil may cri gameplay show nero fight goliath
"355",final fantasi xv devil may cri pokemon fire red silent hill final fantasi ix
"356",final fantasi x metal gear solid devil may cri need speed underground grand theft auto v
"357",new devil may cri amaz
"358",ima cop devil may cri
"359",the last us god war life strang persona devil may cri i dont anyth relat betw
"360",devil may cri will photo mode train mode
"361",devil may cri special edit platinum trophi platinum unlock trophi
"362",marvel vs capcom devil may cri bomberman megaman x modern warfar
"363",resid evil monster hunter except gen final fantasi viii devil may cri gundam versus
"364",devil may cri trish cosplay test
"365",was just brows file rememb laughabl bitter ninja theori old devil may cri fan put
"366",re seem plot differ like devil may cri game
"367",devil may cri dragon age game world warcraft final fantasi crisi core life strang
"368",metal gear solid twin snake legend zelda ocarina time kingdom heart devil may cri tale vesperia
"369",dragonbal fighterz call duti devil may cri sli cooper seri metal gear solid
"370",dark soul devil may cri dota battlefield bad co the world end with you
"371",einhand liveal devil may cri tekken super mario bros
"372",devil may cri silent hill catherin half life serious sam
"373",devil may cri until dawn dead space diablo reaper soul zelda
"374",ladi devil may cri tran evid cisgend woman hear white boy call ladi go well th
"375",metal gear solid twin snake legend zelda ocarina time kingdom heart devil may cri tale vesperia
"376",devil may cri trish cosplay test
"377",devil may cri bloodborn skyrim final fantasi x final fantasi xv
"378",persona nier automata devil may cri monster hunter ultim dungeon dragon fight dd game
"379",devil may cri
"380",world warcraft warcraft leagu legend red alert devil may cri
"381",devil may cri plot dmcv
"382",golden sun devil may cri pokemon emerald skyrim a hat time
"383",live devil may cri continu nero run gt
"384",unchart sonic the hedgehog knuckl count one game like origin plan dm
"385",earn psn trophi bronz devil may cri special edit
"386",devil may cri trish cosplay test
"387",devil may cri hd collect ps download read detail frugal game
"388",donkey kong countri super mario world crash bandicoot devil may cri legend zelda breath wild
"389",mega man x devil may cri resid evil kof midnight club
