"","x"
"1",this miss mortal kombat decept
"2",mayb avenatti rahm can go mortal kombat street
"3",i like video mortal kombat trilog rainta
"4",good compar everyth els injustic thing compar mortal kombat
"5",retweet favorit game list fifa pes mortal kombat god of war gta watch dog k credi
"6",retweet favorit game list fifa pes mortal kombat god of war gta watch dog k credi
"7",retweet favorit game list fifa pes mortal kombat god of war gta watch dog k credi
"8",resid evil mortal kombat x rainbow sieg monster hunter world bloodborn
"9",retweet favorit game list fifa pes mortal kombat god of war gta watch dog k credi
"10",retweet favorit game list fifa pes mortal kombat god of war gta watch dog k credi
"11",bruh i havent decent mortal kombat competit minut
"12",honor mention horizon zero dawn aero acrobat mortal kombat
"13",mgk brave dude now mention kim well hailey get mortal kombat fatal decent show kel tho
"14",i know i said anyon possibl realli think im gonna mokap mortal kombat
"15",my upcom ppg reboot mortal kombat project
"16",we can play mortal kombat theme repeat play
"17",mortal kombat dalmat puppi rescu ape escap god war twist metal
"18",rt if play fortnit gta minecraft overwatch pubg r sieg rocket leagu leagu legend cod bo cs
"19",i want mortal kombat vs street fighter come
"20",i repres mortal kombat pikachu get frozen shatter piec
"21",the first selfi i took first cosplay jade mortal kombat henc crappi qualiti lol
"22",i like video mortal kombat xl all fatal stage fatal klassic fatal all dlc p
"23",rt if play fortnit gta minecraft overwatch pubg r sieg rocket leagu leagu legend cod bo cs
"24",pervert monk style style knowhatimsayin comin cha afura parapleg fightin
"25",i like video mortal kombat x hate me
"26",check broadcast playstat mortal kombat x live
"27",look like someth mortal kombat
"28",pes god war mortal kombat wwe
"29",man nephew whoopin ass mortal kombat
"30",i like video mortal kombat hd remak jason full playthrough freddi krueger final boss
"31",got mortal kombat one hmu feel like whoopin somebodi ass
"32",yasss it time great show almightymort kombat tourna
"33",i like video mortal kombat movi scorpion subzero
"34",in best mortal kombat voic it has begun
"35",so bnha problem prereboot mortal kombat that odd
"36",brianna ray amp kali kaval amp staci savag lesbo milf make love scene video
"37",i like video mortal kombat x hate me
"38",the miz play johnni cage mortal kombat rebo
"39",the new mortal kombat select screen weird
"40",we just receiv sweet sega saturn stuff marysvill store mortal kombat ii panzer dragoon av
"41",can pleas come mortal kombat
"42",woman beauti perfect bodi white lingeri combocamscom mortal kombat mileena
"43",y want mortal kombat deceptionshoalin monk remast
"44",kitana kitana kitana kitana mortal kombat u mañana i step in this bitch and i do what i want
"45",in opinion biggest cun traitor mortal kombat histori
"46",this first time im hear mgk man came nowher finish eminem play mortal kom
"47",the new mortal kombat select screen weird
"48",moon life strang mortal kombat armageddon pokemon fire gta san andrea
"49",nicola cage new mortal kombat movi mortalkombat
"50",mortal kombat one favourit time mortalkombat
"51",ps twist metal n majora mask dreamcast marvel vs capcom ps shadow colossus gamecub
"52",mortal kombat one favourit time mortalkombat
"53",the legend zelda snake eater final fantasi tactic donkey kong countri mortal kombat
"54",i ad video playlist shinnok throw away scorpion head scene mortal kombat xl
"55",oh sniper elit where zoom shot enter peopl like mortal kombat style
"56",nba jam the simpson mortal kombat
"57",regist play fifa stand chanc win k attend play game like mortal
"58",mk armageddon bad video game glad buy singl mortal kombat game trilog mk p
"59",mortal kombat studio have fun end day studio lx factori
"60",share the wife slutcamsxyz young bound anal margo sullivan stock tube teen ass c
"61",the inspir revolutionari action ive ever seen manag video game etc let us play mortal kom
"62",i ad video playlist ultim mortal kombat mishap gold
"63",resid evil mortal kombat silent hill the evil within doom
"64",i like video mortal kombat project season ultim updat suprem demonstr
"65",mk armageddon bad video game glad buy singl mortal kombat game trilog mk p
"66",the best predat self destruct brutal combo ever mortal kombat x predat gameplay
"67",just found comment mortal kombat theme
"68",i ad video playlist mortal kombat mishap gold reupload
"69",mk armageddon bad video game glad buy singl mortal kombat game trilog mk bu
"70",dont get start mortal kombat pick jade re definit lesbian sorri dont make rule
"71",i like video mortal kombat mishap gold reupload
"72",oh gotta talk subzero his chiropractor busi get much repeat busi b
"73",put mortal kombat charact killer instinct pleas
"74",which follow type new charact like futur mortal kombat game which sound cool
"75",put mortal kombat charact killer instinct pleas
"76",retweet favorit game list fifa pes mortal kombat god of war gta watch dog k credi
"77",immedi type mortal kombat begin jam grimi ass pit theme
"78",lmao u play mortal kombat dont button figur yet
"79",i like video goku vs mortal kombat
"80",sfa street rage sonic knuckl shinobi mortal kombat u bought gonna say l
"81",rex mcmaster mortal kombat type name will go w one
"82",which follow type new charact like futur mortal kombat game which sound t
"83",i like video mortal kombat x mobil assassin jade challeng full hard difficulti
"84",the first selfi i took first cosplay jade mortal kombat henc crappi qualiti lol
"85",she alway look like mortal kombat convent
"86",mortal kombat x let get klassic scorpion fusion vivii monster hunter world later
"87",rex mcmaster mortal kombat type name will go w one
"88",retweet favorit game list fifa pes mortal kombat god of war gta watch dog k credi
"89",and i thought kabal hideous face mortal kombat
"90",rex mcmaster mortal kombat type name will go w one
"91",rex mcmaster mortal kombat type name will go w one
"92",sex guy gay porn xxx trent climb top glide pornogaysexoyoutub
"93",half life mortal kombat super mario brother timesplitt futur perfect the stanley parabl
"94",stryker gotta worst mortal kombat charact ever we suppos believ outta shape cop can beat lui kang ass
"95",mortal kombat x mobil assassin jade challeng full hard difficulti
"96",i like video mortal kombat x mobil assassin jade challeng full hard difficulti
"97",super mario world mortal kombat ii baldur gate call duti littl big planet
"98",i like video what did she just do to him mortal kombat x
"99",en mortal kombat sale krato krato sale en soul calibur en soul calibur sale link link sale en smash bros cloud sal
"100",final fantasi x chrono cross super mario sunshin final fantasi ix mortal kombat decept
"101",en mortal kombat sale krato krato sale en soul calibur en soul calibur sale link link sale en smash bros cloud sal
"102",no lie i kid baddest femal mileena mortal kombat
"103",honest game legendari if know mortal kombat you know
"104",en mortal kombat sale krato krato sale en soul calibur en soul calibur sale link link sale en smash bros cloud sal
"105",mortal kombat ii gran turismo age empir ii la noir toni hawk pro skater
"106",en mortal kombat sale krato krato sale en soul calibur en soul calibur sale link link sale en smash bros cloud sal
"107",this anim fit mortal kombat ii
"108",i like video mortal kombat chaotic season scorpion mk full playthrough
"109",i like video mortal kombat x mobil first time play
"110",the import question which charact pick mortal kombat
"111",hi im art ive work game year titl ive work includ saint row dlc missi
"112",i like video mortal kombat jukejoint jezebel giorgio morod metropoli mix
"113",video game final fantasi i cant decid one diablo dragon warrior mortal kombat ico
"114",was spine surgic remov sub zero mortal kombat rip
"115",mortal kombat x mobil first time play
"116",tekken gauntlet dark legaci silent hill mortal kombat trilog turok
"117",vampir masquerad bloodlin king quest lord ring onlin mortal kombat starcraft
"118",i like video mortal kombat cobainevermind mkx livestream fps
"119",check broadcast playstat mortal kombat xl live
"120",mortal kombat trilog psx gameplay comeplet uncut
"121",
"122",watch mortal kombat instead take pre work nap
"123",the first selfi i took first cosplay jade mortal kombat henc crappi qualiti lol
"124",shinnok throw away scorpion head scene mortal kombat xl
"125",for dose u say mgk kill eminem lol u know day moment step pitbul tail discov
"126",final fantasi x omega rubi undertal mortal kombat fire emblem
"127",just listen now some part will hit nerv bit much he decid
"128",en mortal kombat sale krato krato sale en soul calibur en soul calibur sale link link sale en smash bros cloud sal
"129",the first selfi i took first cosplay jade mortal kombat henc crappi qualiti lol
"130",smalltit babe cocksuck bukkak action rachel steel facial son babe knot dog
"131",mega man sonic unchart mortal kombat star war jedi academi
"132",i like video my favorit fatal mortal kombat trilog mugen cyrax ladder part
"133",maali raw make mortal kombat beat
"134",en mortal kombat sale krato krato sale en soul calibur en soul calibur sale link link sale en smash bros cloud sal
"135",i like video insan critic damag team mortal kombat x mobil
"136",i dont mortal kombat dead allianc anywher sight pal fake news
"137",the boat guid charact mortal kombat
"138",i like video mortal kombat defend of the realm episod
"139",mortal kombat theme song origin
"140",supersmash bros gamecub halo cod modern warfar classic mortal kombat burnout
"141",come sometim play mortal kombat
"142",en mortal kombat sale krato krato sale en soul calibur en soul calibur sale link link sale en smash bros cloud sal
"143",the charact mortal kombat tekken wait user pick
"144",in opinion biggest cun traitor mortal kombat histori
"145",well i said mortal kombat histori mean biggest one ever matter timelin
"146",check broadcast playstat mortal kombat xl live
"147",i like video mortal kombat x predat dlc klassic arcad ladder gameplay playthrough
"148",in opinion biggest cun traitor mortal kombat histori
"149",find live forest mortal kombat decept
"150",you know time bed your random listen mortal kombat theme tune rate banger though
"151",in opinion biggest cun traitor mortal kombat histori
"152",i ad video playlist mortal kombat mileena vs kitana cosplay
"153",nah look like mortal kombat charact
"154",gta v far cri mortal kombat metal slug dragon ball z
"155",ssx tricki overwatch ffx mortal kombat ddr
"156",my favorit game night dream cours sonic mortal kombat
"157",my brother mad i mileena mortal kombat jsjsjsksk
"158",i like video mortal kombat ii kano transform shawn attack game mysteri
"159",when get hit mortal kombat fatal
"160",the mortal kombat battl millenium ninja vs skinless man
"161",the big match set tonight watch i destroy mortal kombat armageddon team high skill
"162",final fantasi resid evil silent hill assassin creed mortal kombat
"163",the best coolest mortal kombat cosplay
"164",stryker gotta worst mortal kombat charact ever we suppos believ outta shape cop can beat lui kang ass
"165",en mortal kombat sale krato krato sale en soul calibur en soul calibur sale link link sale en smash bros cloud sal
"166",en mortal kombat sale krato krato sale en soul calibur en soul calibur sale link link sale en smash bros cloud sal
"167",mortal kombat killer instinct gta starfox die hard trilog
"168",there preiron man except notabl s mortal kombat tmnt movi
"169",en mortal kombat sale krato krato sale en soul calibur en soul calibur sale link link sale en smash bros cloud sal
"170",en mortal kombat sale krato krato sale en soul calibur en soul calibur sale link link sale en smash bros clou
"171",mortal kombat one favourit time mortalkombat
"172",sous la douch mallu homemad movi diamond jacson solo hd freefrenchpornvid com yung
"173",those day hmm good question ya follow first game y
"174",world warcraft the sim ultim mortal kombat skate guitar hero
"175",the year your cousin come hous play mortal kombat segatv game the game want
"176",i like video mortal kombat ii kano transform shawn attack game mysteri
"177",mortal kombat charact look dopest
"178",mortal kombat ii super mario world loz oot cod mwii pokemon red honor mention loz botw
"179",your ugli play mortal kombat scorpion say stay
"180",retweet favorit game list fifa pes mortal kombat god of war gta watch dog k credi
"181",i like video this feel like a ronda rousey fight too soon mortal kombat x mirror match
"182",mortal kombat xl mario kart doubl dash monster hunter world pokemon blue turok evolut lol
"183",profession mortal kombat cosplay avail kid parti long s yard school
"184",well i major jackbox game gang beast human fall flat
"185",retweet favorit game list fifa pes mortal kombat god of war gta watch dog k credi
"186",retweet favorit game list fifa pes mortal kombat god of war gta watch dog k credi
"187",when s first time play mortal kombat re tri figur move charact
"188",if play mortal kombat spam move say dont hate player hate game i cant fuck wit period
"189",happi bday xavier wood hufe fan game youtub channel becki lynch well top
"190",have seen the run man it kind like take mortal kombat
"191",this game pretti fun move mortal kombat feel memor
"192",lou watch mortal kombat slight nsfw warn blood violenc gore women show b
"193",regist play fifa stand chanc win k attend play game lik
"194",the big match set tonight watch i destroy mortal kombat armageddon team high skill
"195",
"196",the mortal kombat battl millenium ninja vs skinless man
"197",fapzon cassi cage mortal kombat x hot blond pussi fuck hard dxxxvideo com hen
"198",so readi mortal kombat remak
"199",the first selfi i took first cosplay jade mortal kombat henc crappi qualiti lol
"200",i play fortnit fuck chun i street fight bust back you aint got combo rock bit
"201",jone look like sc
"202",it two morn im drink redd play mortal kombat jenni
"203",batman arkham citi pokémon platinum the legend zelda ocarina time red dead redempt mortal kombat x har
"204",i like video mortal kombat new charact suggest list guest charact
"205",mortal kombat occasion violent angri streak
"206",the first selfi i took first cosplay jade mortal kombat henc crappi qualiti lol
"207",australian artist syke e mix hip hop music littl sublimin mortal kombat feel definit check one
"208",when reeeeaaalli love mortal kombat
"209",borderland mortal kombat xl fallout injustic resid evil
"210",i enjoy play pax i hope make futur ps i got extra code
"211",this realli hard top head doom fallout mortal kombat the og battlefront ii gta vice citi
"212",i like video blue steel sub zero with the most seen brutal ever mortal kombat x sub zero
"213",i like video reptil get my fastest quital ever mortal kombat x reptil gameplay
"214",retweet favorit game list fifa pes mortal kombat god of war gta watch dog k credi
"215",australian artist syke e mix hip hop music littl sublimin mortal kombat feel definit check one
"216",nina fior lisa gili italian smokin hot teen slut trento free pictur
"217",tekken mortal kombat spyro dragon og trilog crash team race bloodborn
"218",final fantasi viii final fantasi ix mortal kombat decept kirbi crystal shard dynasti warrior
"219",get real joy sex categoryteen com hardcor photo celena gomez jade mortal ko
"220",ps twist metal n majora mask dreamcast marvel vs capcom ps shadow colossus ga
"221",gear war tomb raider old style mortal kombat jade empir need i say
"222",watch dog mortal kombat injustic
"223",check broadcast playstat mortal kombat xl live
"224",mortal kombat x the return of the gunsling
"225",right he pull julia chang move tekken tag tourney come johnni crunch mortal kombat
"226",slit cock lick teen ann anal free nigerian hardcor mortal kombat sonya blowjo
"227",also yes have play mortal kombat hour am mad even regret
"228",id happi mayb annouc like ultim mortal kombat x edit charact baraka other
"229",the king fighter super street fighter ii turbo mortal kombat ii super mario world donkey kong countri
"230",imo mortal kombat movi realli hold year it suck still blow now
"231",i like video ultra street fighter mortal kombat skin mod
"232",it anyth like mortal kombat number one reason play
"233",brain explod hit la like actual play all movi mortal kombat
"234",a can dodg bullet stupit ma dad ask want blue pill pill said gee
"235",i rememb it came week mortal kombat week the propheci i rememb re
"236",magic the gather halo the master chief collect mortal kombat xl fivecard draw poker star war battlefront
"237",and mortal kombat like shaolin monk imagin
"238",the witcher star war kotor sea thiev mortal kombat mario kart
"239",honour mention dead daylight mario sunshin mario parti gear war mortal kombat
"240",shrimp tsung shrimp good suck soul bodi like shang tsung mortal kombat
"241",in honor i post fan art bro i one favorit wwe superstar
"242",we know this just like shini mortal kombat just spam doken
"243",retweet favorit game list fifa pes mortal kombat god of war gta watch dog k credi
"244",gonna just variat soul calibur street fighter mortal kombat tekken game
"245",doctor easi seduc and bang horni patient nikki benz mov blowjob hardcor jess ja
"246",have code level flu watch mortal kombat it shit s good shit
"247",toni hawk ratchet clank up your arsenal mortal kombat shaolin monk mario kart doubl dash super mario d world
"248",play old school game like pac man mortal kombat
"249",overwatch injustic ani mortal kombat twist metal black team sonic race though yet
"250",the big match set tonight watch i destroy mortal kombat armageddon team high skill
"251",shimmer blond italiano blowjob fuckedupfaci com gp european school porn amateur t
"252",check broadcast playstat mortal kombat x live
"253",mortal kombat charact halloween
"254",fatal like mortal kombat
"255",the babe i play mortal kombat biano manchi didnt understand happen bec
"256",driver god war the king fighter castlevania mortal kombat
"257",driver god war the king fighter castlevania mortal kombat
"258",one imag mortal kombat group bad guy
"259",i like video mortal kombat arcad glitch cheat livestream
"260",zelda ocarina time last us sim mortal kombat tomb raider
"261",this first time im hear mgk man came nowher finish eminem play mortal kom
"262",the first selfi i took first cosplay jade mortal kombat henc crappi qualiti lol
"263",scorpion outworld went live twitch mortal kombat xl live
"264",im gamer fifa mortal kombat tekken sonic crash
"265",mortal kombat iii super mario gunstar hero warcraft iii diablo
"266",honest game legendari if know mortal kombat you know
"267",the first selfi i took first cosplay jade mortal kombat henc crappi qualiti lol
"268",my fave game mele good count lol mele overwatch kingdom heart chibi r
"269",mom lick teen piper perri veronica vain mortal kombat lesbian jade video milf su
"270",retweet favorit game list fifa pes mortal kombat god of war gta watch dog k credi
"271",ninja gaiden black alien vs predat battlefield mortal kombat and obvious minecraft im belliger man
"272",everyon game love i go one game i hate all megaman game
"273",mortal kombat cosplay costum that will blow you away
"274",the big match set tonight watch i destroy mortal kombat armageddon team high skill
"275",i repres mortal kombat link one get finish
"276",damn got beat w tha mortal kombat shirt erythin
"277",they frickin mortal kombat aracd machin relax room how cool
"278",the last us dark soul iii super mario world castlevania symphoni night ultim mortal kombat
"279",anim cross mario paint mortal kombat dead allianc clay fighter super mario
"280",check broadcast playstat mortal kombat x live
"281",final fantasi xiv kingdom heart life strang super mario bros ultim mortal kombat
"282",cori mk stand mortal kombat
"283",retweet favorit game list fifa pes mortal kombat god of war gta watch dog k credi
"284",por ordem tempo mortal kombat street fighter the king fighter cs pubg
"285",the first selfi i took first cosplay jade mortal kombat henc crappi qualiti lol
"286",gnome news uf mortal kombat seal event gnome game gbw gnome game get over here we mean
"287",the first selfi i took first cosplay jade mortal kombat henc crappi qualiti lol
"288",i like video fatal de freezer en mortal kombat mucho personaj mas
"289",the first selfi i took first cosplay jade mortal kombat henc crappi qualiti lol
"290",are we done mortal kombat ii restor part make it end
"291",english i first karat lesson today rox my name sonya blade i compet mortal kombat roxi
"292",lawddddd bout mortal kombat
"293",scene star nake video sonya mortal kombat nude sexi black chick sex hood black teen bitch drunk nake
"294",know back kid great lol awesom mortal kombat great lol
"295",it aw i help love see also mortal kombat movi d
"296",get over here mortalkombat continu scorpion dnd
"297",im fan block earli block often but im also run presid mortal kombat platform
"298",no lie i kid baddest femal mileena mortal kombat
"299",retweet favorit game list fifa pes mortal kombat god of war gta watch dog k credi
"300",loz majora mask pokemon emerald elder scroll morrowind phoenix wright ace attorney mortal kombat
"301",punch out street fighter final fantasi sonic mortal kombat what era man
"302",mass effect donkey kong countri tropic freez fallout resid evil mortal kombat x
"303",fallout nv overwatch mortal kombat x dishonor bioshock infinit
"304",wait mortal onlin not mortal kombat onlin
"305",time ultim mortal kombat armageddon grudg match appar
"306",tomb raider silent hill mortal kombat
"307",im fan block earli block often but im also run presid mortal kombat platform
"308",loooooool mero alway respond s mortal kombat just heard finish him
"309",are we done mortal kombat ii restor part make it end
"310",red dead redempt unchart mortal kombat halflif assassin creed
"311",im fan block earli block often but im also run presid mortal kombat platform
"312",rememb guy next monday host mortal kombattekken tournament if midland area get
"313",saw friend post thought sound fun here go if recommend someon play game
"314",this gif alway mortal kombat final boa entranc lmaoo
"315",retweet favorit game list fifa pes mortal kombat god of war gta watch dog k credi
"316",i want ask fight game communiti but prefer mortal kombat x injustic bot
"317",got ass hand play mortal kombat last night smh dont ask turn
"318",live ps tourmoi mortal kombat x road to
"319",got crash bandicoot mortal kombat xl i havent abl play could final get detroit becom human
"320",unchart god war mortal kombat x nba k batman arkham citi
"321",this first time im hear mgk man came nowher finish eminem play mortal kom
"322",the big match set tonight watch i destroy mortal kombat armageddon team high skill
"323",retweet favorit game list fifa pes mortal kombat god of war gta watch dog k credi
"324",chrono trigger ultim mortal kombat age empir ii the age king resid evil the last us
"325",will mortal kombat releas ever we need game
"326",mortal kombat voic fanart friday
"327",explor mortal kombat deep lore like find kid went primari school drew worri
"328",mortal kombat shaolin monk sf sleep dog shinobi strikernew love mk
"329",mortal kombat lol famoso liga das lenda ragnarok pokemon rubi resid evil
"330",retweet favorit game list fifa pes mortal kombat god of war gta watch dog k credi
"331",mortal kombat armageddon quak mass efect whos your daddi peggl probabl
"332",retweet favorit game list fifa pes mortal kombat god of war gta watch dog k credi
"333",well rememb mortal kombat
"334",accuracysn mortal kombat even blood
"335",the first mortal kombat fun least
"336",this first time im hear mgk man came nowher finish eminem play mortal kom
"337",if year later im still find new cool stuff mortal kombat x i wait
"338",accuracysn mortal kombat even blood
"339",super smash bros entir seri mortal kombat entir seri no more hero desper struggl unreal tournam
"340",mayb avenatti rahm can go mortal kombat street
"341",accuracysn mortal kombat even blood
"342",accuracysn mortal kombat even blood
"343",portal rainbow six sieg hous flipper bubbl bobbl mortal kombat
"344",yakuza resid evil sonic hero street fighter mortal kombat shoalin monk
"345",mortal kombat nintendo n video game cart conditionaccept
"346",final fantasi iii bad mojo mortal kombat doom ii mario kart ohmigod im old
"347",gta sleep dog last of us lara croft mortal kombat
"348",this first time im hear mgk man came nowher finish eminem play mortal kom
"349",midwestern punkass kid magic circl either toyota insur mortal kombat cabinet
"350",mayb avenatti rahm can go mortal kombat street
"351",this first time im hear mgk man came nowher finish eminem play mortal kom
"352",are we done mortal kombat ii restor part make it end
"353",metal gear solid pokemon heartgold mortal kombat kingdom heart i grandia ii
"354",y want mortal kombat deceptionshoalin monk remast
"355",mortal kombat street fighter
"356",guess who just got nd place in mortal kombat xl at it ya girl what up
"357",gear war mortal kombat x infam halo the last us
"358",cum love teen enjoy huge bukkak interraci stand doggi style jade mortal komb
"359",i like video i got the secret scorpion brutal mortal kombat x scorpion gameplay mkxl
"360",retweet favorit game list fifa pes mortal kombat god of war gta watch dog k credi
"361",yeah man total still thing ive just realli busi project aint arrang
"362",the mortal kombat battl millenium ninja vs skinless man
"363",this miss mortal kombat decept
"364",this miss mortal kombat decept
"365",mortal kombat doom tloz a link to the past super mario sunshin paper mario the thousand year door
"366",the big match set tonight watch i destroy mortal kombat armageddon team high skill
"367",mayb avenatti rahm can go mortal kombat street
"368",the big match set tonight watch i destroy mortal kombat armageddon team high skill
