"","x"
"364",halloween sticker ghost sicker moonlitprint
"365",okay so ive mind now sometim octob im go make trick go back
"366",play ghost trick phantom detect
"367",the best steam ham video hand down i love ghost trick
"368",episod now live check favourit podcast app hope enjoy show
"369",episod now live check favourit podcast app hope enjoy show
"370",episod now live check favourit podcast app hope enjoy show
"371",halloween spider sticker trick treat sticker halloween parti favor tag ghost sticker goodi bag sticker set o
"372",episod ghost trick now upload we discuss street rage nintendo war rom tri best con
"373",halloween spider sticker trick treat sticker halloween parti favor tag ghost sticker goodi bag sticker set o
"374",wait hasnt play ghost trick
"375",whatll happen misti play ghost trick
"376",halloween spider sticker trick treat sticker halloween parti favor tag ghost sticker goodi bag sticker set o
"377",halloween spider sticker trick treat sticker halloween parti favor tag ghost sticker goodi bag sticker set o
"378",halloween spider sticker trick treat sticker halloween parti favor tag ghost sticker goodi bag sticker
"379",lol ghost prank best i im alon lia trick kid m
"380",ghost confetti halloween confetti halloween parti scari confetti halloween ghost ghost parti trick or trea
"381",ghost trick come chicken didnt core ghost chicken
"382",tear run cheeki bcs follow back ghost trick hotel dusk o
"383",ghost trick mandatori game play one game one read t
"384",i just found shu takumi ace attorney ghost trick wrote anim littl song dog missil
"385",the time ghost trick got charact pill guzzl right thought w
"386",the greatest trick devil ever pull convinc world exist ghost angi
"387",im beg pleas just play ghost trick
"388",trick treat ghost type now
"389",dislik ghost trick actual illeg
"390",all copi ghost trick secret curs dislik dumb petti reason will di
"391",dear ghost time now pull trick angela got question i got ask i hope ca
"392",
"393",ghost confetti halloween confetti halloween parti scari confetti halloween ghost ghost parti trick or trea
"394",i need play ghost trick proper a shame score lowand dare choos fortnit
"395",it john told tommi dad understood need tell ghost shoul
"396",liter fault ghost trick masterpiec
"397",ghost trick complex seri rube goldbergti interact achiev mechan precis result punch
"398",knockknocktrick ore treat who im ghost im littl ghost
"399",final season power just pray ghost dont let angela trick
"400",went trick treat dowoon mcds bc ghost dare well ghost let meet dowoon otl
"401",want look ghost trick tag get spoil will find nearest skyscrap jump
"402",i pull ghost sheet tricktreat bar omg
"403",i pull ghost sheet tricktreat bar omg
"404",im beg pleas just play ghost trick
"405",i like video real life trick shot dude perfect reaction
"406",theyr cool underr game ve even better in word play ghost tri
"407",just play ghost trick
"408",daili remind play ghost trick havent godlik stori best charact
"409",play ghost trick
"410",trick treat ghost type now
"411",play ghost trick
"412",jeebus i great ghost trick i younger
"413",jeebus i great ghost trick i younger
"414",just finish record latest episod cant wait get edit special thank
"415",ghost confetti halloween confetti halloween parti scari confetti halloween ghost ghost parti trick or trea
"416",ghost trick incred
"417",ghost trick
"418",ghost trick great game i sleep
"419",im sorri ur ghost situat peanut butter also trick love u
"420",you mention missil ghost trick mention least three
"421",just finish record latest episod cant wait get edit special thank
"422",just finish record latest episod cant wait get edit special thank
"423",just finish record latest episod cant wait get edit special thank
"424",just finish record latest episod cant wait get edit special thank
"425",peopl stop parlor trick re spin bunch plate stick d fuck hype
"426",all hallow evetyp o negat halloweenth misfit trick treatfastway squar hammerghost scari
"427",it year i still love art direct ghost trick
"428",have play ghost trick if game io first chapter free otherwis bu
"429",i play game w protag name jonathan charlott it nintendo ds someon help i forgot
"430",still find bizarr layton got anim like im happi keep forget ooh yeah layton anim sa
"431",spur barcelona busquet thiago insign sergio busquet got a hat trick insan work hi
"432",im sorri ur ghost situat peanut butter also trick love u
"433",ghost trick slept oml game great
"434",ghost confetti halloween confetti halloween parti scari confetti halloween ghost ghost parti trick or trea
"435",if re short just go sheet ghost halloween can trick treat without judgement ppl will just t
"436",proud ima tri soon whole world will play ghost trick
"437",if peopl meet io devic can get play first ghost trick chapter freegtgtgtgtgtgt
"438",what game i play next a captain toad treasur tracker switch b ghost trick phantom detect ds c profe
"439",ghost confetti halloween confetti halloween parti scari confetti halloween ghost ghost parti trick or trea
"440",knockknocktrick ore treat who im ghost im littl ghost
"441",ghost trick bge
"442",trick util pictur ghost
"443",if re short just go sheet ghost halloween can trick treat without judgement ppl wi
"444",way absolut gem man shu takumi bailey danc ghost trick
"445",ghost trick sure short sweet amaz visual music one best stori ive e
"446",ghost confetti halloween confetti halloween parti scari confetti halloween ghost ghost parti trick or trea
"447",ghost trick ghost trick ghost trick ghost trick ghost trick ghost trick ghost trick ghost trick ghost
"448",what game i play next a captain toad treasur tracker switch b ghost trick phantom detect ds c
"449",week left let i can cram ghost trick merch mayb octol pin
"450",liter fault ghost trick masterpiec
"451",pleas play ghost trick
"452",ghost town cheap trick
"453",the video fake they mask hand throat if look car
"454",play ghost trick
"455",trick util pictur ghost
"456",the video fake they mask hand throat if look
"457",im replay ghost trick realli good also im realli bad ghost trick get sick seei
"458",knockknocktrick ore treat who im ghost im littl ghost
"459",now play cheap trick ghost town clarus radio
"460",new halloween tricktreat ghost dog
"461",missil de ghost trick
"462",trick treat ghost type now
"463",phoenix wright sissel ghost trick they make lot sens just make game perfect
"464",ghost trick
"465",ghost trick treat tote bag grab cute trick treat tote bag littl one the tote will hit
"466",mr robot ghost trick tv show cant explain good wo spoil anyway watch mr robot
"467",fuck dark level prison guard hunter ghost trick worst thing ever happen even
"468",good idea trick watch
"469",local cat attack ghost trick game order get attent
"470",ghost confetti halloween confetti halloween parti scari confetti halloween ghost ghost parti trick or trea
"471",ghost trick ubyiwrhoef i gotta like be in the zone to play it but i promis to pick it up again within the
"472",the respons woman film video make seem stage a good ole lifeless just le
"473",new halloween tricktreat ghost dog
"474",ghost confetti halloween confetti halloween parti scari confetti halloween ghost ghost parti trick or trea
"475",ghost trick realli fun omg
"476",we gear talk thing ghost trick phantom detect next episod record weekend look
"477",oh man end ghost trick alway get grin like loon cant wait talk podcast
"478",oh man end ghost trick alway get grin like loon cant wait talk podcast
"479",subject chang sun nd pm ghost trick phantom detect wed th pm wind waker wednesday thur
"480",test what hit ghost hurt steel brass get trick question
"481",got ds now i need children mana ghost trick super princess peach kingdom heart sim
"482",is trick question like ghost produc is test
"483",ghost confetti halloween confetti halloween parti scari confetti halloween ghost ghost parti trick or trea
"484",ghost confetti halloween confetti halloween parti scari confetti halloween ghost ghost parti trick or trea
"485",ghost confetti halloween confetti halloween parti scari confetti halloween ghost ghost parti trick or trea
"486",ill probabl get vita pervi ghost trick vn element sound fun
"487",i want start look game great never got much ador im start tag
"488",play ghost trick
"489",play ghost trick
"490",the trick get shot haunt attack you shoot ghost
"491",we gear talk thing ghost trick phantom detect next episod record weekend look
"492",knockknocktrick ore treat who im ghost im littl ghost
"493",man just know littl ghost write trick took run best you need find
"494",we gear talk thing ghost trick phantom detect next episod record weekend look
"495",we gear talk thing ghost trick phantom detect next episod record weekend lo
"496",ghost trick sissel
"497",check i just ad closet poshmark vintag trick treat ghost wood pin
"498",nowplay kdub radio cheap trick ghost town
"499",play ghost trick bayonetta game goat play shenmu yet also play super monkey ball
"500",one havent play bayo shenmu ghost trick
