"","x"
"369",sonic hedgehog ultim mortal kombat super smash bros skate tomb raider
"370",mortal kombat cosplay top
"371",sonic hedgehog ultim mortal kombat super smash bros skate tomb raider
"372",talk mortal kombat man bitch littl psycho bitch remind dina
"373",the big match set tonight watch i destroy mortal kombat armageddon team high
"374",mayb avenatti rahm can go mortal kombat street
"375",mayb avenatti rahm can go mortal kombat street
"376",mayb avenatti rahm can go mortal kombat street
"377",mayb avenatti rahm can go mortal kombat street
"378",mayb avenatti rahm can go mortal kombat street
"379",ticket long mortal kombat go mk time bring battl begin
"380",i ad video playlist mortal kombat smoke aprenda o combo de reset
"381",theme hospit final fantasi x anim cross mortal kombat tomb raider
"382",nigga play mortal kombat like hoe
"383",video anthoni search free brotherfucksi mobil gayboy com jade mortal kombat porn
"384",mortal kombat voic fanart friday
"385",this first time im hear mgk man came nowher finish eminem play mortal kom
"386",whi mortal kombat anim yet
"387",tudo velharia mortal kombat super mario world princ persia street fighter tibia
"388",i think time bless disguis it like mortal kombat your shao khan no ha
"389",im old shinobi the legend zelda mortal kombat megaman x the last us
"390",s anyon dc can beat mortal kombat ill buy drink
"391",i like video johnni cage vs scorpion mortal kombat
"392",hello guy i new video lestplay mortal kombat
"393",i like video mortal kombat ii restor part balli midway arcad wire polo monitor
"394",mega man x the legend zelda shinobi mortal kombat the last us
"395",fran bow detroit becom human life strang mortal kombat wolf among us
"396",u play marvel vs capcom fun game kinda like mortal kombat
"397",this first time im hear mgk man came nowher finish eminem play mortal kom
"398",rt if play fortnit gta minecraft overwatch pubg r sieg rocket leagu leagu legend cod bo cs
"399",all mortal kombat fatal base chuck norri move
"400",listen play mortal kombat mytholog cant get wors can
"401",sonic the hedgehog street rage we love katamari mortal kombat batman arkham citi
"402",bayonetta mortal kombat crash bandicoot diablo skullgirl
"403",mortal kombat favorit game play christma im buy ps
"404",guilti charg sinc i kid play street fighter mortal kombat
"405",my mortal kombat playmat
"406",well fight mortal kombat
"407",i like video tas ultim mortal kombat snes dark fulgor
"408",retweet favorit game list fifa pes mortal kombat god of war gta watch dog k credi
"409",spyro year dragon bloodborn dark soul mortal kombat gang beast
"410",leagu legend mortal kombat tomb raider halo odst reach csgo
"411",it like play mortal kombat test luck it altern fun format
"412",announc mortal kombat pack includ raiden kitana subzero liu kang scorpion killer instinct pleas
"413",retweet favorit game list fifa pes mortal kombat god of war gta watch dog k credi
"414",this first time im hear mgk man came nowher finish eminem play mortal kom
"415",bizardon play mortal kombat x steam last hour
"416",announc mortal kombat pack includ raiden kitana subzero liu kang scorpion killer instinct pleas
"417",i like video mortal kombat dead allianc scorpion flawless victori veri hard pstas
"418",mortal kombat vs dc univers remast pleas
"419",well i hope kid know fight ll catch kid fist skill learnt mortal kombat
"420",metal slug mortal kombat injustic god among us god war counter strike
"421",
"422",retweet favorit game list fifa pes mortal kombat god of war gta watch dog k credi
"423",not sure ive play lol side note just score mortal kombat vs dc wait ship
"424",retweet favorit game list fifa pes mortal kombat god of war gta watch dog k credi
"425",most power charact
"426",this first time im hear mgk man came nowher finish eminem play mortal kom
"427",hmmmmmmmm wwf no merci the sim fifa mortal kombat toni hawk pro skater
"428",i like video uf mortal kombat x sub zero deck profil
"429",stryker gotta worst mortal kombat charact ever we suppos believ outta shape cop can beat lui kang ass
"430",
"431",i like video mortal kombat ii restor part balli midway arcad wire polo monitor
"432",wild arm alter code f ps mortal kombat xbox ps pc injustic xone ps pc goof troop s
"433",are we done mortal kombat ii restor part make it end
"434",starcraft half life hearthston mortal kombat world warcraft
"435",just arriv mortal kombat platinum seri player action
"436",starcraft half life hearthston mortal kombat world warcraft
"437",would ever interest fight game ie streetfight hope mortal kombat dragonbal fightz
"438",stryker gotta worst mortal kombat charact ever we suppos believ outta shape cop can beat lui kang ass
"439",cambiz hot sassyhelen flash pussi live webcam vidio sex manusi hewan shemasl solo
"440",keyshia kaoir dress like mortal kombat charact
"441",stryker gotta worst mortal kombat charact ever we suppos believ outta shape cop can beat lui kang ass
"442",mortal kombat x one player singl fight
"443",mortal kombat street fighter
"444",pyramid head great bonus charact mortal kombat
"445",maso congrat joke ps era mayb look alien isol injustic doom mortal
"446",german eboni bitch get assfuck couch girl from wwwfreehookerga manoylia anal
"447",retweet favorit game list fifa pes mortal kombat god of war gta watch dog k credi
"448",my fave game mele good count lol mele overwatch kingdom heart chibi r
"449",my fave game mele good count lol mele overwatch kingdom heart chi
"450",retweet favorit game list fifa pes mortal kombat god of war gta watch dog k credi
"451",gameplay mortal kombat x
"452",teyana taylor look like sheeva mortal kombat
"453",keyshia kaoir dress like mortal kombat charact
"454",keyshia kaoir dress like mortal kombat charact
"455",are we done mortal kombat ii restor part make it end
"456",let guess he play mortal kombat lui kang favorit charact
"457",this first time im hear mgk man came nowher finish eminem play mortal kom
"458",congratul robert snyder won poquoson ptc anakari mill deck featur fatal card f
"459",brought pencil nuclear war mortal kombat finish
"460",i like video street fighter vs mortal kombat vs the king fighter updat
"461",nonprofession crossdress tube pornomamacita teen porn yearold mandi majest har
"462",retweet favorit game list fifa pes mortal kombat god of war gta watch dog k credi
"463",i ad video playlist mortal kombat x rank get some jax
"464",resid evil toni hawk pro skater shin megami tensei nocturn chrono trigger half life ultim mortal kombat
"465",i ad video playlist gren duart vs ernesto saenz pinolero mortal kombat amm
"466",she like motaro mortal kombat
"467",a nightmar elm street nes mortal kombat ii sega genesi resid evil nemesi ps resid evil ps
"468",uh uh want final fantasi x hollow knight witcher sim mortal kombat
"469",i ad video playlist livan santana vs josu telleria pinolero mortal kombat amm
"470",webcam make blow job first time video site wwwcamslslcom anisia
"471",tekken pokemon mortal kombat dead aliv resid evilsil hill
"472",this first time im hear mgk man came nowher finish eminem play mortal kom
"473",no one understand im allow mean ever mean will g
"474",i love mortal kombat ermac scorpion subzero noob saibot in short way give ninja p mile
"475",final fantasi monster hunter world midnight club dub edit remix im petti i want extra shit lol m
"476",this first time im hear mgk man came nowher finish eminem play mortal kom
"477",check broadcast playstat mortal kombat x live
"478",kingdom heart god of war smash bros mortal kombat db fighterz
"479",retweet favorit game list fifa pes mortal kombat god of war gta watch dog k credi
"480",derrick rememb murder ass georg mortal kombat
"481",mortal kombat x video drop soon be readi
"482",this first time im hear mgk man came nowher finish eminem play mortal kom
"483",fear halo reach dark soul leagu legend prototyp i think anyway there lot game
"484",starcraft leagu legend wow mortal kombat injustic
"485",the groov mortal kombat decapit mix el tdeep the piano medit skyy danc mix
"486",case person emetophobia play plan play mortal kombat xl charact call bo rai cho
"487",retweet favorit game list fifa pes mortal kombat god of war gta watch dog k credi
"488",bonus round god turrican blood money it came from the desert mean street donkey kong countri jump flash
"489",my copi mortal kombat arriv today the trilog complet mortalkombat
"490",my copi mortal kombat arriv today the trilog complet mortalkombat
"491",retweet favorit game list fifa pes mortal kombat god of war gta watch dog k credi
"492",exact i rememb play mortal kombat friend help write review end u
"493",this first time im hear mgk man came nowher finish eminem play mortal kom
"494",worri earn benefit doubt i beta readi ill definit give
"495",i like video crouch tiger netotigr vs liu kang mortal kombat x hilari must see
"496",i hope em want finish like mortal kombat so hard blood max yeah
"497",halo unchart splinter cell doubl agent mortal kombat decept marvel ultim allianc
"498",download mortal kombat complet edit pc game mediafir link thank guy sub share mediafir download
"499",retweet favorit game list fifa pes mortal kombat god of war gta watch dog k credi
"500",this first time im hear mgk man came nowher finish eminem play mortal kom
