"","x"
"1",the stori brand new ps game similar batman arkham game it follow comic movi
"2",new shop
"3",record new episod tonight well discuss song rumor
"4",what great usa second biggest pollut sell militari hardwar extremi
"5",holi crap batman tom off his med and back sht post entertain at it finest
"6",fact eminem fall music video shot locat batman vs superman dawn of justic movi
"7",you either die hero live long enough becom villain batman
"8",see love batman rais fkin boy right
"9",precis like set
"10",
"11",lol idea nerdi stuff isnt insan mainstream hahaha last decad everi maj
"12",hi bill the origin affleck script best batman script ive eve
"13",actual realli favorit batman film
"14",ben affleck script best batman script ive ever read say storyboard artist
"15",tekken music summon faster batsign batman
"16",be care batman lex luthor power doom palm hand revisit thrill battl justic le
"17",ill take idiot opinion batman alex
"18",jay oliva the origin affleck script best batman script ive ever read ben kick ass stori i believ th
"19",here anoth recent commiss world finest superhero superman batman
"20",saw internet round morn batman anim seri remast look glorious
"21",lol idea nerdi stuff isnt insan mainstream hahaha last decad everi maj
"22",tbh tv gt movi
"23",ben affleck script the batman best batman script ive ever read say storyboard artist
"24",precis like set
"25",is batman save french region dont laugh
"26",batman lazi
"27",riddl batman kap horribl doesnt deserv nike campaign did i miss someth
"28",saw internet round morn batman anim seri remast look glorious
"29",batman adventur cgc grade st appear harley quinn
"30",for year bruce wayn put everyth batman and fell revisit batman ahead batman
"31",so greatbatman
"32",lol idea nerdi stuff isnt insan mainstream hahaha last decad everi maj
"33",man steel batman v superman justic leagu
"34",i save playlist batman
"35",fuck wrote batman remix jingl bell
"36",no way
"37",there market accept gay batman comic it want thing want ha
"38",fellow nerdi type i got hand copi batman walmart edit it tran
"39",ill take idiot opinion batman alex
"40",have mindset the joker action batman few get
"41",buhahahaha true back now i just cram much star war batman read i get time
"42",mommi babi boy batman
"43",bandai tamashii nation sh figuart batman the dark knight in action figur
"44",bandai tamashii nation sh figuart batman the dark knight in action figur
"45",batman forev
"46",what can i say im copi cat
"47",not meet greet moment
"48",tbh amount billionair none becam batman just disappoint
"49",is batman save french region dont laugh
"50",saw internet round morn batman anim seri remast look glorious
"51",lol idea nerdi stuff isnt insan mainstream hahaha last decad everi maj
"52",well bob go ahead name sourc wont will tha
"53",there assumpt kavanaugh knew man i dont know honest
"54",cass offend barbara gordon oracl if regard whether bruce wayn batman murder
"55",ive alway favor ace batman connect
"56",from onlin offlin how brand use batman figur out where their custom will shop
"57",you know wasnt batman
"58",i think brett kavanaugh anyth apolog whi meet someon h
"59",batman gcs take past minut talk american war propaganda wish bush die love
"60",so greatbatman
"61",even said yeah i fuck
"62",this better work
"63",saw internet round morn batman anim seri remast look glorious
"64",are listen bob woodward revel holi shit batman
"65",saw internet round morn batman anim seri remast look glorious
"66",mani time brain go make depress rude bitch get tire want
"67",kavanaugh show wear pair batman nike high top justdoit
"68",this trap this clear mark trap there sign bug bunni lean say this is a t
"69",jay oliva call affleck batman script best batman script
"70",bruce wayn didnt becom batman it doesnt matter old there still time full blown drama
"71",we batman
"72",a lot rpgs stori heavi game tend hide lot stuff especi got big twist
"73",year pain tell stori batman joker yet one know chapter
"74",saw internet round morn batman anim seri remast look glorious
"75",hi bill the origin affleck script best batman script ive eve
"76",im lost
"77",jay oliva call affleck batman script best batman script
"78",holi aesthet batman
"79",i like video john doe best end final outcom batman season the enemi within episod
"80",i like video btch i gotta batman cup
"81",this better work
"82",in aftermath bruce wayn born ace
"83",how dare whi one talk disgust act rian johnson commit
"84",check batman costum
"85",hate break kavanaugh will be confirm kavanaughconfirm
"86",retweet favorit game list fifa pes mortal kombat god of war gta watch dog k credi
"87",i love fatman beyond name chang im read lot negat comment regard fact t
"88",ben affleck saw geoff john batman script
"89",i like video batman v superman final battl the death of superman
"90",retweet favorit game list fifa pes mortal kombat god of war gta watch dog k credi
"91",saw internet round morn batman anim seri remast look glorious
"92",shion gone girl batman fought murphi
"93",hi bill the origin affleck script best batman script ive eve
"94",pleas dont hop whip i deadass zoom i drive like jame bond batman summm lmfao
"95",lol idea nerdi stuff isnt insan mainstream hahaha last decad everi maj
"96",current watch batman return i ador portray penguin absolut fuck powerhou
"97",know happen say yl three time mirror batman appear slam head
"98",batmandad bod
"99",im serious about to do that ill fuck stream it if i have to
"100",hi bill the origin affleck script best batman script ive eve
"101",are listen bob woodward revel holi shit batman
"102",retweet favorit game list fifa pes mortal kombat god of war gta watch dog k credi
"103",shut mikey kid said rape star war
"104",what fuck think meant slurp so immatur peopl posit d
"105",fact eminem fall music video shot locat batman vs superman dawn of justic movi
"106",batman tomorrow s excit issu sure not get write duti
"107",batman piec nycc chariti auction
"108",jay oliva the origin affleck script best batman script ive ever read ben kick ass stori i believ th
"109",lol idea nerdi stuff isnt insan mainstream hahaha last decad everi maj
"110",gruffl garbbl nois batman voic
"111",ben affleck script the batman best batman script ive ever read say storyboard artist
"112",btw like ben affleck batman i think aw
"113",last night i play batman robin guess one i check
"114",click full version batman fenc phil winslad
"115",jay oliva the origin affleck script best batman script ive ever read ben kick ass stori i believ th
"116",im batman realli i
"117",i work seri awhil i think i like hero like i lost everyth
"118",your current batman sunbaenim name life
"119",retweet favorit game list fifa pes mortal kombat god of war gta watch dog k credi
"120",ben affleck script best batman script ive ever read say storyboard artist
"121",name time best book movi tv show opinion batman seri gotham
"122",lol idea nerdi stuff isnt insan mainstream hahaha last decad everi maj
"123",what fuck think meant slurp so immatur peopl posit disgust
"124",man favorit charact joker batman joker batman mask phantasm joker dar
"125",harley quinn batman arkham knight episod
"126",batman multipl platform spiderman one therefor batman
"127",saw internet round morn batman anim seri remast look glorious
"128",love first sight
"129",are listen bob woodward revel holi shit batman
"130",lol idea nerdi stuff isnt insan mainstream hahaha last decad everi maj
"131",batman arkham cityknight devil may cri black max payn gear war
"132",how i forget ever id love batman beyond
"133",this better work
"134",year pain tell stori batman joker yet one know chapter
"135",ben wrote amaz batman script im surpris sinc i stan talent
"136",we snake come meet batman rumour make appear
"137",holi nickel batman kosman just left tip offlin thank senpai
"138",fact eminem fall music video shot locat batman vs superman dawn of justic movi
"139",hellblad senua sacrific dead space batman arkham citi doom metro last light
"140",marvel spiderman best super hero game sinc batman arkham asylum the swing combat new york citi
"141",new justic leagu earth world end swamp thing thor god thunder hickman new aveng honora
"142",lil tariq hood batman
"143",joaquin phoenix got skinni joker im readi your readi fuck batman even readi man
"144",hey everyon here date kirbi batman collect i tri includ everyon
"145",batman psst nudg alfr awak can grill chees
"146",retweet favorit game list fifa pes mortal kombat god of war gta watch dog k credi
"147",id welcom summer pawar the current candid rang uninspir full batman villain
"148",yeah i read back evid ben affleck want hang cowl in
"149",allstar squadron annual justic leagu america vol new teen titan the juda
"150",jay oliva the origin affleck script best batman script ive ever read ben kick ass stori i believ th
"151",lol idea nerdi stuff isnt insan mainstream hahaha last decad everi maj
"152",lol idea nerdi stuff isnt insan mainstream hahaha last decad everi maj
"153",ben affleck script best batman script ive ever read say storyboard artist
"154",bring back squishi batman
"155",angela asgard assassin loki agent
"156",are listen bob woodward revel holi shit batman
"157",if anoth arkham batman game made tri get mark hamil back voic joker go troy ba
"158",jay oliva the origin affleck script best batman script ive ever read ben kick ass stori i believ th
"159",woohoo thank
"160",i i final kill batman in front bunch vulner disabl kid now get santa claus
"161",angela asgard assassin loki
"162",say everyth joker done rumor start batman spr
"163",i ad video playlist batman bruce wayn batman v superman featurett subtitl
"164",be care batman lex luthor power doom palm hand revisit thrill battl justic le
"165",are listen bob woodward revel holi shit batman
"166",fact eminem fall music video shot locat batman vs superman dawn of justic movi
"167",red background w batman mask
"168",jay oliva the origin affleck script best batman script ive ever read ben kick ass stori i believ th
"169",by billion peopl global access broadband smartphon how can help
"170",good afternoon the cake cut clean ice when shawti come around i clean nice dynam
"171",holi back back class batman
"172",vintag dc comic batman piec golden jigsaw puzzl brand new seal
"173",vintag dc comic batman piec golden jigsaw puzzl brand new seal
"174",vintag dc comic batman piec golden jigsaw puzzl brand new seal
"175",fellow nerdi type i got hand copi batman walmart edit it tran
"176",vintag dc comic batman piec golden jigsaw puzzl brand new seal
"177",rt million time
"178",batman look unhappi preview look forward stori lead
"179",world expens suv look just like batman follow us detail
"180",batman cave
"181",be care batman lex luthor power doom palm hand revisit thrill battl justic le
"182",good afternoon the cake cut clean ice when shawti come around i clean nice dynam
"183",are listen bob woodward revel holi shit batman
"184",year pain tell stori batman joker yet one know chapter
"185",actual realli posit
"186",good afternoon the cake cut clean ice when shawti come around i clean nice dynam
"187",batman aint got power lmaoooo
"188",listen just like us ben took whole josstic fiasco zack deb betray jl cast cre
"189",good afternoon the cake cut clean ice when shawti come around i clean nice dynam
"190",the tick anim firefli btas batman beyond mash gargoyl yes recent thing firefli not i
"191",the presid twitter account like batman util belt s someth everyth
"192",i like video the flash savitar stab barri this is my world batman v superman dawn of justic
"193",hi bill the origin affleck script best batman script ive eve
"194",just email first draft batman the outsid without support th
"195",batman arkham knight part
"196",the moench batman run the kelli deadpool run spidermanhuman torch long halloweendark victori afterlif arch
"197",ben affleck script best batman script ive ever read say storyboard artist
"198",me batman date tonight thesecretsyoudontknow
"199",blackpanth dc fan y need fight put black superhero movi instead focus superman batman
"200",dc comic batman vs superman oblong viscos scarf light fashion wonder woman new click now
"201",are listen bob woodward revel holi shit batman
"202",hi bill the origin affleck script best batman script ive eve
"203",the muppet show mtvs the state batman the anim seri the soprano communiti just baaaaar edg t
"204",if look batman dick allow get older jason tim stephani etc etc just g
"205",good afternoon the cake cut clean ice when shawti come around i clean nice dynam
"206",dawn parkour batman broke leg
"207",enjoy latest comic book podcast batman
"208",i just reread batman annual s color stun kind support
"209",this even i ran wifi issu video batman arkham knight part stream cut
"210",if michael keaton return batman will like bar mitzvah steroid
"211",whi fall so can learn pick back batman
"212",ben affleck script the batman best batman script ive ever read say storyboard artist
"213",batman piec nycc chariti auction
"214",by billion peopl global access broadband smartphon how can help
"215",also one person trailer live action movi or seri the one
"216",are listen bob woodward revel holi shit batman
"217",ben affleck script best batman script ive ever read say storyboard artist
"218",damn nigma narrow els want leav poor countri folk alon
"219",batman routin beat guy power cap train easi call bat
"220",ben affleck script best batman script ive ever read say storyboard artist
"221",sli cooper trilog ratchet and clank kingdom heart littl big planet batman arkham citi
"222",ben affleck script best batman script ive ever read say storyboard artist
"223",mani thing happen need s help
"224",batman take wheel
"225",batman s xmen evolut
"226",in case y miss i post pretti close finish draft piec choic mani creator make
"227",ill take idiot opinion batman alex
"228",batman approv
"229",ill take idiot opinion batman alex
"230",saw internet round morn batman anim seri remast look glorious
"231",are listen bob woodward revel holi shit batman
"232",nycc commiss it batman
"233",new dc collect batman arkham citi harley quinn porcelain statu mib
"234",serious marvel dc need start let charact age chang sure reason keep superman youn
"235",are listen bob woodward revel holi shit batman
"236",while y cri snyder cut ve best movi ever
"237",lol idea nerdi stuff isnt insan mainstream hahaha last decad everi maj
"238",man favorit charact walter white break bad tyler durden fight club rick rick morti jordan bel
"239",damian wayn fn great charact that damain
"240",dawn parkour batman broke leg
"241",i just finish tell tale batman game your perform face absolut amaz
"242",i guess want deal realiti gun violenc so way deal realit
"243",whos gonna motherfuck play spiderman ps will listen pizza time song
"244",serious marvel dc need start let charact age chang sure reason keep superman youn
"245",back to a far far away galaxi thor
"246",are listen bob woodward revel holi shit batman
"247",they actual said may start scratch build wonder woman aqua
"248",holi follow batman
"249",oh wow great adapt batman lol
"250",video wonder woman add american ninja warrior athlet jessi graff
"251",i just saw season great show but best role date still probabl batman
"252",lol idea nerdi stuff isnt insan mainstream hahaha last decad everi maj
"253",so stop batman kick cap dick break neck
"254",fact eminem fall music video shot locat batman vs superman dawn of justic movi
"255",sorri folk batman tonight i terribl gameplay i show bad game channel ill
"256",so greatbatman
"257",saw post facebook said nike undermin peopl buy apparel favor steal
"258",ill take idiot opinion batman alex
"259",i dont think question pose malic s weird question ask superman w
"260",hi bill the origin affleck script best batman script ive eve
"261",for year bruce wayn put everyth batman and fell revisit batman ahead batman
"262",gtdanni boyl quit bond becaus he refus kill off jame bond gtkill jame bond gtkill jame bond gtkill
"263",again dawn batman glori ben joyc minion mani friend
"264",i realli gotta watch termin
"265",batman forev soundtrack control pedro lion
"266",batman voic actor arkham knight sound like glanc line tax phone
"267",ben affleck script the batman best batman script ive ever read say storyboard artist
"268",they can tri stab back but gave wing haha thank untouch they d
"269",fact eminem fall music video shot locat batman vs superman dawn of justic movi
"270",you buggin bro batman will get hand
"271",pleas rt nail quotholi ravioli batmanquot trelli polish
"272",are listen bob woodward revel holi shit batman
"273",i vote actor can top christian bale batman
"274",hi bill the origin affleck script best batman script ive eve
"275",we thought batman annual sentiment issu ever read wrong batman lik
"276",holi mumbojumbo war room rhetor
"277",alright the giveaway twitter close congrat d dm info let know
"278",i just want everyon know im current work lesson plan includ elvi big mama thornton batman pink floyd
"279",deadass said dark knight dark night
"280",hot wheel scale batman batmobil batcopt classic tv car west
"281",hot wheel scale batman batmobil batcopt classic tv car west
"282",jay oliva call affleck batman script best batman script
"283",thank batman
"284",jay oliva call affleck batman script best batman script
"285",toy tuesday the craziest coolest batman toy
"286",i feel good
"287",oh yeah batman def web swing arkham game
"288",the evalu batman logo
"289",platinum trophi batman the enemi within awesom stori
"290",cant wait third tier batman villain get next
"291",lol idea nerdi stuff isnt insan mainstream hahaha last decad everi maj
"292",instead say bane exist i alway say bane batman realli convey messag
"293",batman by scott snyder and greg capullo box set us price on sale the final four volum stori f
"294",jay oliva the origin affleck script best batman script ive ever read ben kick ass stori i believ th
"295",this make sens it lead fluid long last ip base upon familiar
"296",join parti re play batman wont regret were live right
"297",lol idea nerdi stuff isnt insan mainstream hahaha last decad everi maj
"298",alright boss ive got next one carri kelley robin batman sourc
"299",batman return dir tim burton dp stefan czapski firstandfinalfram
"300",again dawn batman glori ben joyc minion mani friend
"301",spat loyal fan face trade hokag level mos bvs formula pigsti level hope optim disney flavour jos
"302",probabl yeah especi playstat hit thing
"303",saw internet round morn batman anim seri remast look glorious
"304",so greatbatman
"305",ben affleck script best batman script ive ever read say storyboard artist
"306",lol idea nerdi stuff isnt insan mainstream hahaha last decad everi maj
"307",gtdanni boyl quit bond becaus he refus kill off jame bond gtkill jame bond gtkill jame bond gtkill
"308",ben affleck script best batman script ive ever read say storyboard artist
"309",have mindset the joker action batman few get
"310",lol idea nerdi stuff isnt insan mainstream hahaha last decad everi maj
"311",batman return arkham arkham asylum
"312",he look like penguin batman i wonder that coincident
"313",lol idea nerdi stuff isnt insan mainstream hahaha last decad everi maj
"314",imagin cartoon come s action scene without music pure sound design n
"315",serious marvel dc need start let charact age chang sure reason keep superman youn
"316",are listen bob woodward revel holi shit batman
"317",to that weirdest thing work w affleck script hard believ hed t
"318",fellow nerdi type i got hand copi batman walmart edit it tran
"319",day back herk just watch boy run across park lot yell batman sever time wear batman hoodi
"320",cass offend barbara gordon oracl if regard whether bruce wayn batman murder
"321",lol idea nerdi stuff isnt insan mainstream hahaha last decad everi maj
"322",there lot happen paycheck i wish w
"323",watch make fun dentastik now plush chaotic
"324",the batman what mysteri role could oscar isaac play
"325",batman robin
"326",marvel spiderman best super hero game sinc batman arkham asylum the swing combat new york citi
"327",you forgot qualifi best batman movi ever nippl mold bat suit
"328",this seri spider man batman made love superhero i watch hulu now
"329",lol idea nerdi stuff isnt insan mainstream hahaha last decad everi maj
"330",im dealership watch batman vs superman shit fake af this nigga batman realli fuck superman
"331",ben affleck script the batman best batman script ive ever read say storyboard artist
"332",are listen bob woodward revel holi shit batman
"333",buffi batman anim seri elementari game throne the west wing
"334",ben affleck script best batman script ive ever read say storyboard artist
"335",ben affleck script the batman best batman script ive ever read say storyboard artist
"336",lol idea nerdi stuff isnt insan mainstream hahaha last decad everi maj
"337",batman begin
"338",batman your genius
"339",im hope dc can give us live action invent anim showsfilm r nonbruc batman
"340",i hope batmanlik one like pictur just post look like standard fac
"341",peep unicorn hand batman pant
"342",batman piec nycc chariti auction
"343",have mindset the joker action batman few get
"344",jay oliva the origin affleck script best batman script ive ever read ben kick ass stori i believ th
"345",there two type peopl world peopl understand someon say re fine s l
"346",hi bill the origin affleck script best batman script ive eve
"347",jay oliva call affleck batman script best batman script
"348",the evalu batman logo
"349",vintag photo slide boy read batman dc comic book the hulk pajama
"350",i won achiev batman arkham citi point
"351",i still need finish honest
"352",lol idea nerdi stuff isnt insan mainstream hahaha last decad everi maj
"353",i like video batman the movi nostalgia time amiga c zx spectrum k
"354",are listen bob woodward revel holi shit batman
"355",gtdanni boyl quit bond becaus he refus kill off jame bond gtkill jame bond gtkill jame bond gtkill
"356",here jack salli nightmar befor christma ftw kaz brekker inej ghafa six crow roy musta
"357",game pretti cheap now id say pick
"358",be care batman lex luthor power doom palm hand revisit thrill battl justic le
"359",splatoon obvious i admit im addict franchis batman arkham game batman gucci enough sai
"360",lol idea nerdi stuff isnt insan mainstream hahaha last decad everi maj
"361",so appear trump moron wo intellectu depth emot stunt mental ill
"362",have mindset the joker action batman few get
"363",hannib bate motel batman the anim seri penni dread xfile
"364",again dawn batman glori ben joyc minion mani friend
"365",nice ive own ps year ive bare play big game
"366",lol idea nerdi stuff isnt insan mainstream hahaha last decad everi maj
"367",batman sinc master multipl martial art problem cheat win fight
"368",nuevo modelo de playera importada dnm batman who laugh ts med watchmen batman symbol ts med
"369",the great dark knight batman robin i ever wit h
"370",fiveguy
"371",see peopl realiz make entir fuck batman gambit perfect twitter
"372",now i know batman stay singl
"373",holi white male privileg batman
"374",hi bill the origin affleck script best batman script ive eve
"375",now pretti good job alreadi like us ww settl one nuke
"376",new rim sexi fuck thank guy unk mc batman com love
"377",year pain tell stori batman joker yet one know chapter
"378",man favorit charact walter white break bad tyler durden fight club rick rick morti jordan bel
"379",that good one here jack salli nbc kaz brekker inej ghafa six crow roy mu
"380",well obvious d bathound doberman black great dane howev bat
"381",lol idea nerdi stuff isnt insan mainstream hahaha last decad everi maj
"382",hi bill the origin affleck script best batman script ive eve
"383",with scarecrow run loos everyon see monster even robin share review batman beyond
"384",batman the anim seri black mirror break bad fastlan save by the bell if tv
"385",year pain tell stori batman joker yet one know chapter
"386",i love batman leg i chun li one well i shall take pic soon do follow instagram i
"387",check dynasti happi hour articl the adp mirag vi
"388",trust massiv massiv step game great
"389",take zina bash make prank ok symbol camera left will go absolut apeshit
"390",tell reev isnt amaz im go miser replac movi send
"391",type exampl their use
"392",oh well s opinion f batman show
"393",the joker plan captur harvey dent shoot rocket direct
"394",fuck batman
"395",if movi univers noth tv univers give us superman batman tv show
"396",lol idea nerdi stuff isnt insan mainstream hahaha last decad everi maj
"397",oh yeah batman def web swing arkham game
"398",are listen bob woodward revel holi shit batman
"399",i misread batman invent maraca
"400",so keep mind want attack john john cool affleck script wrote togeth
"401",name time best book movi tv show opinion all movi batman
"402",lol idea nerdi stuff isnt insan mainstream hahaha last decad everi maj
"403",still play lost legaci main problem got realli repetit fe
"404",persona the witcher yakuza batman arkham citi snake eater
"405",new batman the telltal seri season like sub batman the telltal seri season ep
"406",what promis make batman
"407",man favorit charact walter white break bad tyler durden fight club rick rick morti jordan bel
"408",there two type peopl world peopl understand someon say re fine s l
"409",jay oliva the origin affleck script best batman script ive ever read ben kick ass stori i believ th
"410",are listen bob woodward revel holi shit batman
"411",good element god fall apart one amaz perform
"412",cant tell look like meanest member cobra kai villian grant morrison batman run
"413",jay oliva call affleck batman script best batman script
"414",oh yeah batman def web swing arkham game
"415",theyv never seen best batman movi ever so weird
"416",ricki morti batman anim seri john adam star trek tng enterpris borgiatom fonta
"417",superhero costum halloween kid super hero adult batman child spiderman
