"","x"
"390",metal gear solid shadow colossus devil may cri kingdom heart metal gear solid
"391",i like video dmc all of nero new devil breaker arm in devil may cri
"392",doom sonic cd devil may cri dragon ball fighterz overwatch
"393",devil may cri special edit mission trisagion
"394",devil may cri
"395",devil may cri devil may cri devil may cri devil may cri dmc devil may cri
"396",hey save wizard cheat devil may cri work hd collect
"397",legend dragoon devil may cri se tale vesperia gundam vs zeta gundam soul calibur
"398",the windwak devil may cri ori blind forest reson fate celest
"399",a video alreadi written welcom nhk masterpiec the tragedi video game cover perso
"400",featur dant devil may cri seri
"401",nierautomata the wake dead season kingdom heart devil may cri dant awaken a hat time
"402",deitado pensando nele devil may cri featur dant devil may cri seri
"403",halflif dark soul devil may cri se doom shovel knight
"404",to anyon consid purchas devil may cri hd collect dmc special edit sale xbox one
"405",mega man x devil may cri resid evil metroid fusion sonic k
"406",tale berseria metal gear solid devil may cri disc mayb final fantasi viii ocarina time
"407",bloodborn dark soul persona devil may cri final fanta
"408",nine hour nine person nine door final fantasi vii mother nier devil may cri
"409",question anyon excit dmc i love devil may cri seri i feel like boy dant wrong whi
"410",rise tomb raider devil may cri gta v the walk dead season mass effect amanhã sai outra lista
"411",sin punish xenoblad chronicl street fighter devil may cri fzero
"412",devil may cri nero devil breaker arm type perk and move detail
"413",sonic adventur battl devil may cri just caus super smash brother ultim pokemon black white
"414",super mario odyssey horizon zero dawn cuphead devil may cri super smash bros ultim
"415",live devil may cri continu nero run gt
"416",devil may cri gameplay show nero fight goliath
"417",ladi devil may cri tran evid cisgend woman hear white boy call ladi g
"418",this mod skyrim add fight anim popular devil may cri seri game
"419",devil may cri look good
"420",devil may cri prototyp persona injustic smite
"421",was just brows file rememb laughabl bitter ninja theori old devil may cri fan put
"422",go mgk got homi pull devil may cri ass
"423",devil may cri will photo mode train mode
"424",ps tenchu sotn n harvest moon dreamcast ikaruga ps metal gear solid gamecub etern dark xbox ninja
"425",devil may cri doom final fantasi roller coaster tycoon symphoni night
"426",me gustó un video de devil may cri hd remast lucia walkthrough mission all blue
"427",ps vagrant stori n fzero x ooc dreamcast phantasi star onlin ps devil may cri gamecub etern dark ps dra
"428",ps tekken n legend of zelda majora mask dreamcast shenmu ps devil may cri gamecub super monkey ball
"429",was just brows file rememb laughabl bitter ninja theori old devil may cri fan put
"430",also im happi chose correct devil may cri
"431",was just brows file rememb laughabl bitter ninja theori old devil may cri fan put
"432",devil may cri onimusha tale symphonia legend zelda oot dynasti warrior
"433",persona devil may cri spyro metroid prime metal gear solid
"434",was just brows file rememb laughabl bitter ninja theori old devil may cri fan put
"435",the devil may cri storylin sort base old poetri book a divin comedydant inferno dant name
"436",bloodborn the bind isaac devil may cri dmc the last us skyrim
"437",mario kart doubl dash mario parti super smash bros sonic adventur devil may cri
"438",a lot s super metroid metal gear solid devil may cri darkstalk street fighter i
"439",ñarder may cri con xose llosa street rage cyberpunk y devil may cri ñardersmaycri
"440",super metroid devil may cri splatoon fallout sonic adventur
"441",symphoni of the night smt strang journey metroid prime resid evil cvx devil may cri
"442",devil may cri gameplay show nero fight goliath
"443",dmc devil may cri yes one metal gear rise need speed most want pokemon colosseum
"444",devil may cri resid evil crash team race silent hill the curs monkey island lt
"445",expect lewi talk devil may cri time
"446",metroid prime sonic generat devil may cri mega man x resid evil
"447",pokemon emerald fire emblem awaken super smash bros xenoblad chronicl devil may cri
"448",devil may cri onimusha resid evil code veronica
"449",devil may cri ace attorney team fortress sonic adventur earthbound
"450",we celebr devil may cri live stream began devil may cri
"451",i like video devil may cri part a new begin
"452",final fantasi viii kingdom heart bbs devil may cri se warfram dragon dogma
"453",the witcher devil may cri resid evil god of war silent hill
"454",is devil may cri refer
"455",was just brows file rememb laughabl bitter ninja theori old devil may cri fan put
"456",final fantasi tactic street rage devil may cri doom super mario bros
"457",was just brows file rememb laughabl bitter ninja theori old devil may cri fan put
"458",resid evil leagu legend fortnit devil may cri rainbow sieg
"459",the real devil may cri friend made along way
"460",silent hill dragon age ii bioshock devil may cri persona
"461",onimusha yakuza tekken devil may cri monster hunter
"462",spiderman shatter dimens assassin creed revel batman arkham citi injustic dmc devil may cri
"463",devil may cri final fantasi breath fire suikiden tale vesperia
"464",the legend zelda final fantasi devil may cri monster hunter
"465",was just brows file rememb laughabl bitter ninja theori old devil may cri fan put
"466",dmc devil may cri final fantasi xi kingdom heart dragon age inquisit sonic pretti much w
"467",i ad video playlist let play devil may cri part dant stori
"468",let play devil may cri part dant stori
"469",devil may cri gameplay show nero fight goliath
"470",we celebr devil may cri live stream began devil may cri
"471",loop in rainbow play devil may cri like s
"472",doe ps origin devil may cri still hold play today find
"473",narrow just enough imo honour mention fallout new vega elder scroll iv obli
"474",devil may cri gameplay show nero fight goliath
"475",you shall rememb consol brought jak daxter ratchet clank sli cooper kill zone onimusha
"476",at long last i can express love devil may cri v meme frustrat get bigger
"477",devil may cri dant reveal gameplay trailer gamescom
"478",devil may cri
"479",devil may cri gameplay show nero fight goliath
"480",devil may cri will poppin later today finish probabl start play hollow knight dlc
"481",devil may cri gameplay show nero fight goliath
"482",ddr extrem metal gear solid capcom vs snk advanc war devil may cri
"483",hm metroid prime donkey kong countri devil may cri ninja gaiden silent hill banjokazooi
"484",golden sun devil may cri metal gear rise blast at full volum pleas hack al
"485",the devil may cri storylin sort base old poetri book a divin comedydant inferno dant wa
"486",tale vesperia pokémon heartgold soulsilv version okami devil may cri metal gear solid the twi
"487",kingdom heart ii till iii come devil may cri till come final fantasi transistor metal gea
"488",devil may cri nova seri
"489",majora mask fabl ii conquer bad fur day castlevania iv devil may cri
"490",kingdom heart devil may cri final fantasi phantasi star onlin tekken
"491",bolen continu first playthrough devil may cri come join
"492",dragon age mass effect final fantasi x resid evil devil may cri leagu legend
"493",devil may cri devil may cri devil may cri special edit virgil devil may cri special edit
"494",metal gear solid god war dark soul devil may cri unchart
"495",bolen continu first playthrough devil may cri come join
"496",bolen continu first playthrough devil may cri come join
"497",was just brows file rememb laughabl bitter ninja theori old devil may cri fan put
"498",play devil may cri hd i pax ama have great first playthrough dmc sub goal
"499",devil may cri gameplay show nero stylish combat
"500",was just brows file rememb laughabl bitter ninja theori old devil may cri fan put
