"","x"
"1",play ghost trick bitch
"2",a is it possibl for you not to be puy for one day nigga you stay slurp drake ball yet em m
"3",ghost trick spoiler i give context
"4",gir halloween ghost trick treat bag
"5",you sure retweet lot lol but interact much youv play ghost tr
"6",lynn ghost trick
"7",lynn ghost trick pleas kind
"8",ghost trick spoiler i give context
"9",persona golden persona sdr ndrv ghost trick think great tast game fav die
"10",game know interest ghost trick time
"11",ghost trick spoiler i give context
"12",check read lenox halloween trick or treat ornament ghost pumpkin bat cat boo
"13",okami shadow colossus kingdom heart birth by sleep danganronpa ghost trick phantom detect
"14",so bob thing ghost realli true doe realli think ghost presid past h
"15",ghost trick spoiler i give context
"16",are high school student still love dress fun halloween feel old go trick tr
"17",super paper mario mother ghost trick phantom detect super mario odyssey undertal
"18",i think second one made cri like time xd lol phoenix wright anoth favorit min
"19",it realli good the whole seri good i wish storyheavi game puzzl o
"20",are high school student still love dress fun halloween feel old go trick tr
"21",sonic adventur ghost trick grandia trapt heavi rain
"22",ghost trick spoiler i give context
"23",ghost trick spoiler i give context
"24",ghost trick phantom detect umineko when they cri the legend hero trail sky ace combat the unsu
"25",pleas play ghost trick
"26",never play ghost trick sorri man
"27",to dude behind traffic snapchatt ghost trick juul blare god plan sir queer
"28",ape escap jet set radio futur ghost trick sonic knuckl sound voltex
"29",maplestori ghost trick devil survivor crook man persona
"30",so bob thing ghost realli true doe realli think ghost presid past h
"31",this ladi react skateboard trick wholesom internet need today
"32",eep the ghost launch feet upward sharp spank onto weightl
"33",are high school student still love dress fun halloween feel old go trick tr
"34",are high school student still love dress fun halloween feel old go trick tr
"35",are high school student still love dress fun halloween feel old go trick o
"36",pokemon mysteri dungeon explor sky ghost trick phantom detect disgaea kid icarus upris literal
"37",ace attorney ghost trick pokemon platinumemerald lttp botw
"38",ghost trick cave stori guilti gear ikaruga unreal tournament
"39",anyway toy shark safe tuck blanket im readi play ghost trick bit go sleep gn
"40",ok ghost trick best game exist
"41",fire emblem dragon nest mmorpg sword mana ghost trick radiant historia like dsgameboy l
"42",game know interest ghost trick time
"43",halloween ghost w black cat ceram cooki jar trick treat david cooki ebay
"44",ghost trick ghost trick ghost trick ghost trick cave stori
"45",ghost trick
"46",oooo hmm ok ghost trick tale borderland yakuza main fun minigam also fightin n
"47",fire emblem dragon nest mmorpg sword mana ghost trick radiant historia like
"48",rune factori professor layton last time travel ghost trick persona peak aesthet lo
"49",ghost trick mother nine hour nine person nine door undertal ace attorney probabl aj i h
"50",so bob thing ghost realli true doe realli think ghost presid past h
"51",th one hard couldnt choos ghost trick twewi smash honor mention also
"52",pokemon dp kingdom heart bbs yakuza ghost trick undertal
"53",knockknocktrick ore treat who im ghost im littl ghost
"54",ghost trick
"55",so bob thing ghost realli true doe realli think ghost presid past h
"56",so bob thing ghost realli true doe realli think ghost presid p
"57",danganronpa im put game deal ghost trick ace attorney all stard
"58",the hous fata morgana xenoblad chronicl x virtu last reward ghost trick butterfli soup ugh hard
"59",chulip okag shadow king ghost trick professor layton the idolm cinderella girl starlight stage hurggg
"60",sonic mania castlevania sotn shenmu panzer dragoon orta ghost trick
"61",ghost trick
"62",in particular order overwatch ghost trick ani ace attorney game final fantasi tactic advanc persona
"63",power stone super mario galaxi life is strang broken sword st game ghost trick phantom detect
"64",pokemon mysteri dungeon explor sky pokemon ranger guardian sign ghost trick apollo justic ace
"65",splatoon ghost trick chibi robo anim cross one project diva futur tone
"66",final fantasi vi kingdom heart ace attorney soft ghost trick persona
"67",runnerup ghost trick submerg oxenfre almsot put pub encount list im sorri
"68",xenoblad chronicl the og pokémon ultra sun the legend zelda breath wild pe
"69",celest the beginn guid ghost trick paper mario thousandyear door soulcalibur v
"70",ghost trick the world end with you legend zelda skyward sword undertal unchart the lost legaci
"71",experi much belov touch stori tri brandnew kind interact mysteri fre
"72",the scare freshen now ship use code sf get check new scarefreshen h
"73",maplestori kh botw pokemon ghost trick anim cross
"74",ghost trick world end pokémon mysteri dungeon okami last guardian
"75",ghost trick radiant historia persona come mind im sure other
"76",ghost trick and twilight princess a man after me own heart
"77",realli indecis gonna cheat group coupl encompass certain aspect golden sun singl pl
"78",celest undertal tale symphonia ghost trick kingdom heart whole seri suffer w pr
"79",honor mention i hard time choos collar x malic super dangan ronpa ace attor
"80",tweet someth similar mother paper mario thousand year door legend zelda w
"81",i think ghost trick touchscreen control make chore play
"82",the ghost steve job jam he just drag music folder onto itun lib
"83",spyro year dragon pokémon silver ghost trick kid icarus upris professor layton lost futur
"84",ghost trick phantom detect pokemon mysteri dungeon explor sky hyper light drifter ace attorney game
"85",trick util pictur ghost
"86",take boy trick treat dog street we look forward junior ghost tour
"87",honor mention ghost trick im puzzl game person
"88",i basic love cute styliz game stori come full circl tbh ghost trick absolut u
"89",hato boyfriend cat ladi ghost trick twewi sad south park fractur whole
"90",ghost trick
"91",yeah i can pick id rather pick ghost trick i like game just bit mor
"92",doubl dragon advanc pacman championship edit dragon quest viii ghost trick ninja kid ii
"93",undertal ace attorney tt professor layton unwound futur ghost trick anim cross new leaf
"94",the world end with you quit obvious ghost trick puyo puyo ar tonelico deemo
"95",dhjh thank u also ghost trick good
"96",your so valid also i cant believ i didnt think of ghost trick im not even sure it wouldv made
"97",trauma team fantasi life ghost trick hour person door anim cross new leaf
"98",transistor ghost trick breath fire wild arm rakuen
"99",brave default mother pokemon mysteri dungeon explor sky sdr pleas play origin dang
"100",rhythm heaven megamix super mario galaxi super smash bros for wii u super mario world ghost trick
"101",in particular order overwatch ghost trick ani ace attorney game final fantasi tactic advanc persona
"102",also entireti zero escap also ghost trick
"103",unchart dragon age the n zelda resid evil ghost trick muthafuckin ski free muthafucka
"104",ghost trick soooo good
"105",ace attorney ghost trick fire emblem path radianc persona innoc sin yakuza
"106",so i just found ghost trick soundtrack itun
"107",grim fandango ghost trick ace attorney dark soul eu iv
"108",ghost trick main theme jazz arrang insaneintherainmus
"109",new itemhalloween trick treat bucket hand paint clear bucketcan custom w name can spider jacko
"110",just remak fav game meme thing ill bite undertal ghost trick the stanley parabl
"111",brave default mother pokemon mysteri dungeon explor sky sdr pleas play origin
"112",in particular order overwatch ghost trick ani ace attorney game final fantasi tactic advanc persona
"113",chrono trigger majora mask ghost trick picross d wario land
"114",ghost trick my world my way psychonaut mass effect shadow destini
"115",okami chrono trigger mega man x ghost trick phantom detect grim fandango
"116",tale abyss zero escap seri golden sun ghost trick off
"117",play ghost trick
"118",hato boyfriend pmd explor sky ghost trick breath wild night wood i feel like selectio
"119",fli ghost candi dish vintag trick treat plate cute ceram halloween wall decor s ghost serv bowl
"120",larg ghost candi basket ceram trick treat bowl x x in vintag halloween decor cute creepi
"121",psychonaut glitch game ghost trick professor layton undertal
"122",heavi rain silent hill super mario world unchart ghost trick
"123",persona phoenix wright the world end with you final fantasi ghost trick phantom detect
"124",ghost trick play peopl import paper pleas zack wiki quest barbaro treasur ib shovel knig
"125",the end ghost trick it truli feel like earn happi end
"126",final fantasi xii kingdom heart ii assassin creed ii ghost trick style boutiqu
"127",doki doki literatur club bind isaac hour person door ghost trick danganronpa
"128",dishonor borderland ghost trick phantom detect professor layton pandora box anim cross
"129",world end rune factori tide destini or rune factori fire emblem awaken ghost trick
"130",i realli realli narrow earli ds game made and art style touch detect ghost t
"131",doki doki literatur club bind isaac hour person door ghost trick danganronpa
"132",um jammer lammi chrono trigger ghost trick okag phoenix wright
"133",the wit fck jnathan blw soma rhythm heaven megamix ghost trick bloodborn
"134",knockknocktrick ore treat who im ghost im littl ghost
"135",tomb raider metroid prime ghost trick layton miracl mask megaman bn doubl team ds
"136",ace attorney professor layton detroit becom human ib ghost trick
"137",ghost trick persona tale symphonia wario land ratchet clank seri
"138",yakuza nier automata persona katamari forev zelda majora mask wind waker i know say i wann
"139",ghost trick phoenix wright ace attorney persona mother pokémon white
"140",anim cross new leaf ghost trick fantasi life fire emblem awaken sim urbz citi
"141",my partner love tabletop game play tabletop rpgs dabbl videogam shes fan g
"142",ghost trick phantom detect final fantasi chrono trigger pokemon mysteri dungeon seri dragon quest seri
"143",trail in the sky mother bayonetta ghost trick paper mario
"144",wind waker persona jet set radio futur ghost trick mass effect
"145",fuck i forgot about danganronpa sorri ghost trick ili think dr taken place
"146",world end mother ghost trick ffxiv granblu fantasi
"147",fuck i should have put ghost trick
"148",mother windwak ghost trick phantom detect phoenix wright ace attorney a link between world
"149",demon soul puyo puyo tetri guilti gear x volgarr vike ghost trick phantom detect
"150",trick util pictur ghost
"151",honor mention rakuen ghost trick vlr undertal persona nier automata brave default botw realli
"152",earthbound zelda majora mask ghost trick oxenfre undertal
"153",play ghost trick
"154",hour person door hous fata morgana nier automata ace attorney trial tribul ghost tri
"155",the talo principl the room seri hamtaro seri hitman elit beat
"156",you arent wrong for recommend it ghost trick is so fuckin good
"157",apollo justic ace attorney dragon age moon ghost trick fuck datesim gay
"158",yoshi island kirbi super star sonic adventur ghost trick harvest moonidk one specif i guess
"159",look someth listen lengthi commut well happili kill hour time chat
"160",ghost trick ace attorney dangan ronpa mother kingdom heart
"161",ghost trick phantom detect red dead redempt bloodborn soul calibur gta vice citi
"162",might see ghost are real he question higher kite realli
"163",honor mention go bayonetta legend zelda link awaken ghost trick horizon zero dawn
"164",trick creat anim ghost code trick
"165",ghost trick ghost trick chad gonna make guess say u love reckless youth mr roundhair park
"166",honor mention aai aa ghost trick virtu last reward crash bandicoot wrath cortex megaman battl network
"167",pokemon sunmoon iconoclast despit avoid undertal ghost trick ace attorney
"168",the legend zelda majora mask ghost trick assetto corsa shin megami tensei persona i like
"169",ghost trick
"170",super mario phoenix wright seri child light paper mario seri ghost trick
"171",guild war sonic adventur super mario sunshin megaman zx advent ghost trick
"172",ghost trick pretti cool you play ghost can possess inanim object find
"173",ppl tl talk abt ghost trick sigh need new phone can enough storag play
"174",persona yakuza ghost trick phantom detect the world end with you dustforc dx
"175",aai aa ghost trick unavow professor layton vs ace attorney anim cross
"176",tale symphonia amaz island chibirobo tron bonn ghost trick
"177",loz majora mask grand theft auto metal gear solid ghost trick pokemon sapphir runner mgsv stardew
"178",this funni halloween design tee excel halloween season gift boy al
"179",pokemon rse ghost trick mother undertal night wood
"180",danganronpa v ghost trick phantom detect world end professor layton last specter dai gya
"181",all professor layton game all ace attorney game ghost trick rhythm heaven earthbound i legit get littl emotio
"182",ghost trick
"183",fe echo ghost trick majora mask metal gear solid nier gestaltreplic
"184",ghost trick
"185",brave fencer musashi final fantasi xi ghost trick undertal hitman
"186",fragil dream farewel ruin moon suikoden ii bitheart ghost trick end roll
"187",pokemon platinum ghost trick kirbi amaz mirror ace attorney origin trilog tale eterni
"188",super paper mario mother im count whole seri one heck u pokemon mysteri dungeon explor time
"189",realli talk much littl exchang seem realli nice dont hesitat
"190",most satisfi zero escap chrono trigger best twist ghost trick danganronpa virtu last reward
"191",thank you ghost trick
"192",oni mega man nuclear throne undertal pacifist rout ghost trick
"193",planescap torment transistor fatal frame ii crimson butterfli ghost trick style savvi trendsett
"194",undertal ace attorney tt professor layton unwound futur ghost trick anim cross new leaf
"195",ghost trick smash bros unchart majora mask super paper mario
"196",harvest moon back natur ffiv snes version ghost trick mass effect disgaea victim choic
"197",forget puzzl game professor layton ace attorney ghost trick will begrudg add bc cool
"198",pleas play ghost trick
"199",halo ghost trick dust an elysian tail anim cross golden sun
"200",ghost trick five time
"201",aa trilog dgs ghost trick game written takushu yeah
"202",ghost trick resid evil acnl mgs peac walker silent hill
"203",kingdom heart ghost trick sword mana disgaea ff tactic a
"204",thief the dark project ghost trick final fantasi tactic advanc or a dishonor bloodborn
"205",abzu tale abyss etrian odyssey iv ghost trick phantom detect legend zelda link awaken
"206",also first four favourit i know id without ghost trick almost made
"207",ghost trick underr
"208",mgs unchart lost legaci ani d zelda ghost trickac attorney danganronpa v
"209",close runner up ghost trick ace attorney trilog rez yume nikki chibi robough hard pick
"210",hour person door witch hous ace attorney specif ghost trick love live bang drea
"211",hour person door witch hous ace attorney specif ghost trick love live ba
"212",a c e a t t t o r n e y ghost trick nier first look just play ghost trick pyre honest mentioni
"213",halloween cross stitch embroid witch scari ghost pumpkin hous trick treat
"214",ghost trick
"215",ghost trick ghost trick
"216",splatoon ghost trick breath wild skyward sword dont overcook
"217",luigi mansion puppet no more hero ghost trick night in the wood
"218",game way short professor layton seri curious villag made cri ghost trick witch hou
"219",honour mention portal stardew ghost trick rhythm heaven
"220",persona phoenix wright ace attorney ghost trick phantom detect fire emblem awaken final fantasi xv
"221",you get extra point name ghost trick
"222",front mission el shaddai ascens metatron halo combat evolv star control ghost trick
"223",ghost trick street rage halflif elit beat agent mgs
"224",portal ghost trick phantom detect phoenix wright ace attorney dual destini professor layton azra
"225",new itemhalloween trick treat bucket hand paint clear bucketcan custom w name can spider
"226",smash ghost trick phantom detect the world end with you megaman battl network plant vs zombi
"227",fuck yeah ghost trick
"228",
"229",ok ill real one ghost trick splatoon undertal recettear patapon
"230",ghost trick ds i sob hard end
"231",dishonor the whole sri okami ghost trick toz windwak toz twilight princess
"232",do ever think huge spoiler end ghost trick caus i everi month life
"233",u ever rememb there moment ghost trick u save someon life swap bullet beani
"234",i wanna play ghost trick caus last time i play senior year high school old ds cra
"235",i case trick signific immedi notic first glanc i
"236",ghost trick phantom detect megaman ace attorney investig rhythm heaven megaman battl network
"237",more concis definit way go but wanna know trick work
"238",i love ghost trick also game veri stress
"239",etrian odyssey untold skyrim mass effect everyth ghost trick phantom detect
"240",rocket leagu doesnt count bc huge outlier mele chrono trigger yakuza zero halo ghost trick
"241",final fantasi vi mother no more hero the wonder ghost trick phantom detect
"242",klonoa door phantomil earthbound wariowar gold paper mario ttyd ghost trick
"243",trick treat halloween
"244",mother super mario rpg ghost trick tetri attack ace attorney
"245",saint row ghost trick night wood yakuza chrono trigger runner unchart
"246",ghost trick bastion thief dead shadow primordia portal
"247",ghost trick dead premonit anim cross megaman x contra hard corp
"248",majora mask portal the walk dead s ghost trick super mario bros
"249",the ghoul kill tongu witch trick treat away face the moon eat brain a ghost cemeteri
"250",chrono trigger ghost trick legend zelda breath wild castlevania symphoni night resid evil rem
"251",i never can resist talk forev fav game katamari pkmn crystal ffxii paper mario tt
"252",pokemon silver yakuza unchart phoenix wright ghost trick
"253",resid evil team fortress smt strang journey ghost trick morrowind
"254",xenoblad twewi taiko tatsujin tale zestiria splatoon honor mention ace attorney ghost trick
"255",same list like ghost trick obscur cult fave jrpg bonus point fan translat
"256",xenoblad chronicl x world end pokemon mysteri dungeon explor sky octopath travel co
"257",tetri hollow knight ghost trick bind isaac stardew valley
"258",okami phoenix wright dual destini ghost trick undertal golden sun
"259",i think tric
"260",play ghost trick
"261",ghost trick devil may cri zelda majora mask sonic knuckl metal gear solid play first
"262",ghost trick phantom detect kirbi planet robobot metroid samus return shadow colossus super mario odi
"263",dai gyakuten saiban persona ghost trick tale borderland cave stori
"264",ghost trick final fantasi dai gyakuten saiban either one two tale symphonia earthbound
"265",sengoku basara sumeragi asura wrath god hand smt nocturn ghost trick
"266",hmmmm hato boyfriend holistar ghost trick pokemon mysteri dungeon undertal liter touhou game
"267",pokemon rseora ghost trick phantom detect kirbi the crystal shard mario parti the boogi
"268",ghost trick undertal dragon quest ix bayonetta dragon dogma
"269",breath wild paper mario thousand year door ghost trick professor layton unwound futur
"270",also sinc ive mention ghost trick pleas play ghost trick crimin underr realli great u l
"271",those just top head tbh probabl better swap two mario odyssey
"272",yeah toei tri trick us like ghost
"273",probabl cheat add seri three zero escap game differ element love zero e
"274",mother ghost trick phoenix wright ace attorney super smash bros brawl professor layton lost futur
"275",professor layton diabol box ori blind forest undertal night wood ghost
"276",earthbound persona undertal ghost trick you dont know jack all version
"277",and also ghost trick
"278",yakuza kiwami ace attorney rhythm heaven touch detect ghost trick
"279",tfw forget golden sun ghost trick tbh s realli hard bc also okami ff iv viii
"280",ghost trick like everyth right excel ost excel charact stori interest engag ga
"281",smt nocturn xenoblad chronicl nier automata ghost trick monster hunter
"282",ghost trick one best game ever made u convinc otherwis
"283",final fantasi ghost trick nier gestalt shin megami tensei devil summon raidou kuzunoha vs king abaddon
"284",good tast op honest like game feel youll enjoy ghost trick
"285",pokémon mysteri dungeon explor of sky phoenix wright ace attorney ghost trick harvest moon ds zero escap vir
"286",ghost trick oxenfre the world end with you night wood phoenix wright ace attorney
"287",liter anytim want buy video game googl game like ghost trick someth someth new will pop up someday
"288",doom pokemon emerald final fantasi ix devil may cri ghost trick
"289",final fantasi xv ghost trick phantom detect ace attorney life strang off morti ghost
"290",add d splatoon ghost trick ocarina time majora mask m sure prefer
"291",wind waker harvest moon mfomt unchart tale symphonia ghost trick
"292",ghost trick anim cross happi home design rhythm heaven phoenix wright ace attorney pac man new adven
"293",pokemon mysteri dungeon hamham heartbreak night wood ghost trick persona
"294",liter fault ghost trick masterpiec
"295",mega man x chrono trigger persona ghost trick shadow colossus
"296",ace attorney ghost trick hotel dusk portal
"297",persona ghost trick shadow colossus devil summon soul hacker anim cross new leaf
"298",ghost trick hollow knight the world end with you golden sun the lost age
"299",shine forc ii sky of arcadia legend ghost trick phantom detect phoenix wright ace attorney trilog life is strang
"300",close contend paper mario paper mario ttyd ghost trick chrono trigger sonic knuckl elit beat agent
"301",the world end with you ghost trick devil may cri mega man x persona
"302",ghost trick ep rube goldberg mini golf cours
"303",play ghost trick five time
"304",ghost trick katamari damaci style savvi trendsett tetri attack classic megaman game i make
"305",phoenix wright ghost trick mirror edg rhythm heaven sonic colour top head
"306",ghost trick katamari damaci style savvi trendsett tetri attack classic megaman game i make
"307",ghost trick katamari damaci style savvi trendsett tetri attack classic megaman game i ma
"308",ghost trick legend zelda minish cap mother tetri castlevania dawn sorrow
"309",finish ghost trick love aaahhh
"310",pyre riven ghost trick ace attorney shanta pirat curs
"311",ace attorney ghost trick hato boyfriend zero escap trauma center
"312",xenoblad chronicl journey metal gear solid zelda tp ghost trick
"313",yeah i stand i said agre said ghost trick great although i p
"314",ghost trick pmd eo moon octopath travel ace attorney investig
"315",ghost trick pokemon mysteri dungeon blue rescu team world end undertal super paper mario
"316",ghost trick klonoa door phantomil osu tataka ouendan digimon world fire emblem path radianc
"317",angela dumb one trick poni lol everytim get info immedi run ghost like damn s
"318",angela dumb one trick poni lol everytim get info immedi run ghost like dam
"319",it year i still love art direct ghost trick
"320",here contribut ghost trick communiti
"321",here contribut ghost trick communiti
"322",here contribut ghost trick communiti
"323",littl trick support kunkka player how reliabl hit ghost ship fleet just eul scepter
"324",look someth listen lengthi commut well happili kill hour time chat
"325",upgrad snake eye now idk w now oc nightmar christma cs idk y sti
"326",look someth listen lengthi commut well happili kill hour time chat
"327",look someth listen lengthi commut well happili kill hour time chat
"328",knockknocktrick ore treat who im ghost im littl ghost
"329",play ghost trick
"330",sissel ghost trick clone tri lay
"331",ebay ladi tshirt boo bee funni halloween ghost slogan trick treat gift
"332",ghost trick
"333",i went trick treat sungjin haunt hous ghost dare bold u assum sungjin g
"334",i went trick treat sungjin haunt hous ghost dare bold u assum sungjin
"335",alway creativ trick sleev client this time includ pirat parrot
"336",ghost halloween i spi bag
"337",an amaz cover amaz game ghost trick truli hidden gem vibrant color charact memo
"338",ghost trick main theme jazz arrang insaneintherainmus
"339",pubg mobil ghost rider bike trick
"340",check make sure undertal ghost trick get correct amount respect disappoint
"341",set of halloween sticker trick treat label ghost sticker goodi bag sticker halloween parti favor ghost s
"342",set of halloween sticker trick treat label ghost sticker goodi bag sticker halloween parti favor gh
"343",it terribl access puzzl reminisc ghost trick nowher near mechan co
"344",know noth ghost trick die dog
"345",know noth ghost trick die dog
"346",a cloud dark i heard littl screech head right toward dark i look tast
"347",spoopi ghost trick trick take money anyway dont matter
"348",it morn perfect time remind mutual play ghost trick phantom detect
"349",i think s gonna becom inform trick em rat dre save ghost
"350",want talk someon even coher thought just jumbl word even
"351",pleas play ghost trick
"352",nah ghost one trick sleev they may pin dre
"353",she gone trick ghost
"354",start get respect i think ghost one trick sleev next week aint way go like
"355",knockknocktrick ore treat who im ghost im littl ghost
"356",also pls play ghost trick pleas leas lay ghost trick
"357",this ladi react skateboard trick wholesom internet need today
"358",i wanna play one someday ds good vn platform phoenix wright ghost trick also fantast
"359",ghost trick tokyo twilight ghost hunter might similar enough style hotel dusk
"360",play ghost trick
"361",sorri kid i wont trick treat u year im watch
"362",i like video crazi disappear magic trick actual work
"363",especi involv latest two show ghost investig add hw tricktreat
