"","x"
"418",lol idea nerdi stuff isnt insan mainstream hahaha last decad everi maj
"419",batman piec nycc chariti auction
"420",becaus cat you run yes and bat i run catch batman h
"421",batman superman fuck girl ranmouri hentai porn hattori sex sonam anim japanes
"422",if batman dog
"423",jay oliva call affleck batman script best batman script
"424",i vote actor can top christian bale batman
"425",so i figur i posit batman light ll show or i can just d
"426",see guy wednesday septemb san jose improv it gonna riot
"427",your terribl daniel
"428",imagin differ batman film first bvs focus differ aspect charact
"429",fellow nerdi type i got hand copi batman walmart edit it tran
"430",now pretti good job alreadi like us ww settl one nuke
"431",are listen bob woodward revel holi shit batman
"432",batman vs silenc isola wrap first arc ed piskor school us xmen latest chirpin review
"433",didnt
"434",take zina bash make prank ok symbol camera left will go absolut apeshit
"435",what batman spaceship
"436",batman joker go well togeth
"437",yeah i love trilog but dark knight still best batman film period lol
"438",hi bill the origin affleck script best batman script ive eve
"439",billboard overr
"440",no i convers public someon friend you alway get pissi batgir
"441",that robin nightw hood batman probabl couldnt even win fight
"442",alec baldwin sign play bruce wayn father joaquin phoenixstarr
"443",stori meh rest good lost legaci blew water tho
"444",i wouldnt mind jeffrey dean morgen flashpoint batman dr wayn just badass
"445",step unleash crimin right batman side
"446",our demon
"447",splatoon obvious i admit im addict franchis batman arkham game batman gucci enoug
"448",hi bill the origin affleck script best batman script ive eve
"449",batman like kid whi dont peopl ever ask question or just decid batman
"450",just email first draft batman the outsid without support th
"451",hi bill the origin affleck script best batman script ive eve
"452",with fed invad wayn manor batman slade will work togeth make one piec share
"453",xiaolin showdown gargoyl legion superhero batman brave bold ben omnivers
"454",batman hand rate e everybodi
"455",there two type peopl world peopl understand someon say re fine
"456",the evalu batman logo
"457",fellow nerdi type i got hand copi batman walmart edit it tran
"458",yes charact superhero s super trope shitti cgi bad write charact d
"459",be care batman lex luthor power doom palm hand revisit thrill battl justic le
"460",just spot batman christma market
"461",i like video ghetto voic batman vs superman
"462",then came
"463",lol idea nerdi stuff isnt insan mainstream hahaha last decad everi maj
"464",tell reev isnt amaz im go miser replac movi send
"465",saw internet round morn batman anim seri remast look glorious
"466",hi bill the origin affleck script best batman script ive eve
"467",the batman everywher
"468",legit disrespect oscar nomin movi bit overr
"469",the evalu batman logo
"470",fellow nerdi type i got hand copi batman walmart edit it tran
"471",im go guess never poor truli poor if don
"472",i heard hear today saw typic hypocrisi democrat come expect do think amer
"473",there one safe nuclear faci
"474",so keep mind want attack john john cool affleck script wrote togeth
"475",some random poster dump corner marbl collegi church
"476",hard
"477",it faramir th centuri q part batman jame bond this movi absurd
"478",loser wear
"479",jay oliva call affleck batman script best batman script
"480",batman save rachel jump window never return face
"481",offic us version park rec break bad stranger thing batman anim seri
"482",i much rather black panther nomin oscar bait eg post
"483",yall realli thought academi golden globe award win big daddi arkham lord batben wasnt gonna give us
"484",momma demi ignor daughter ella cherish son batman will step neck kid foster cat loos cus
"485",bat hero felt dress up mask
"486",come last tonight becaus next week
"487",veri funni robin you know mean say hi beij bob batman
"488",serious marvel dc need start let charact age chang sure reason keep superman youn
"489",liam neeson train batman obi wan darth vader he aslan zeus punch wolv whi kidna
"490",im confus but peopl think actual drone strike shoe what i just need stop r
"491",the chris nolandark knight batman take long time say i just call fascist batman
"492",are listen bob woodward revel holi shit batman
"493",are listen bob woodward revel holi shit batman
"494",fact eminem fall music video shot locat batman vs superman dawn of justic movi
"495",are listen bob woodward revel holi shit batman
"496",start batman the telltal seri season one channel yesterday
"497",hi bill the origin affleck script best batman script ive eve
"498",are listen bob woodward revel holi shit batman
"499",celebr pastor face version batman dilemma die hero preach long enough turn communi
"500",lol idea nerdi stuff isnt insan mainstream hahaha last decad everi maj
